Title,Released,Prod_Budget,Rated,Runtime,Genre,Director,Actors,Pirate_Count,Torrentz_Count,Zoogle_Ver_Count,Total_Torrents
Charlie Wilson's War,2007-12-21,75000000.0,R,102,"Biography, Comedy, Drama",Mike Nichols,"Tom Hanks, Amy Adams, Julia Roberts, Philip Seymour Hoffman",29.0,26.0,12.0,67.0
Now You See Me,2013-05-31,75000000.0,PG-13,115,"Crime, Mystery, Thriller",Louis Leterrier,"Jesse Eisenberg, Mark Ruffalo, Woody Harrelson, Isla Fisher",96.0,323.0,38.0,457.0
Virus,1999-01-15,75000000.0,R,99,"Action, Horror, Thriller",John Bruno,"Jamie Lee Curtis, William Baldwin, Donald Sutherland, Joanna Pacula",11.0,47.0,24.0,82.0
Constantine,2005-02-18,75000000.0,R,121,"Drama, Fantasy, Horror",Francis Lawrence,"Keanu Reeves, Rachel Weisz, Shia LaBeouf, Djimon Hounsou",74.0,247.0,41.0,362.0
Flight of the Phoenix,2004-12-17,75000000.0,PG-13,113,"Action, Adventure, Drama",John Moore,"Dennis Quaid, Tyrese Gibson, Giovanni Ribisi, Miranda Otto",20.0,47.0,17.0,84.0
50 First Dates,2004-02-13,75000000.0,PG-13,99,"Comedy, Romance",Peter Segal,"Adam Sandler, Drew Barrymore, Rob Schneider, Sean Astin",38.0,82.0,16.0,136.0
The Terminal,2004-06-18,75000000.0,PG-13,128,"Comedy, Drama",Steven Spielberg,"Tom Hanks, Catherine Zeta-Jones, Stanley Tucci, Chi McBride",44.0,111.0,38.0,193.0
Immortals,2011-11-11,75000000.0,R,110,"Action, Drama, Fantasy",Tarsem Singh,"Henry Cavill, Mickey Rourke, Stephen Dorff, Freida Pinto",194.0,502.0,35.0,731.0
Lady in the Water,2006-07-21,75000000.0,PG-13,110,"Drama, Fantasy, Mystery",M. Night Shyamalan,"Paul Giamatti, Bryce Dallas Howard, Jeffrey Wright, Bob Balaban",17.0,59.0,17.0,93.0
Minions,2015-07-10,74000000.0,PG,91,"Animation, Action, Comedy","Kyle Balda, Pierre Coffin","Sandra Bullock, Jon Hamm, Michael Keaton, Allison Janney",110.0,470.0,70.0,650.0
Unbreakable,2000-11-22,73243106.0,PG-13,106,"Drama, Mystery, Sci-Fi",M. Night Shyamalan,"Bruce Willis, Samuel L. Jackson, Robin Wright, Spencer Treat Clark",34.0,92.0,23.0,149.0
Snake Eyes,1998-08-07,73000000.0,R,98,"Crime, Mystery, Thriller",Brian De Palma,"Nicolas Cage, Gary Sinise, John Heard, Carla Gugino",16.0,48.0,18.0,82.0
Sphere,1998-02-13,73000000.0,PG-13,134,"Drama, Mystery, Sci-Fi",Barry Levinson,"Dustin Hoffman, Sharon Stone, Samuel L. Jackson, Peter Coyote",20.0,80.0,28.0,128.0
Fool's Gold,2008-02-08,72500000.0,PG-13,112,"Action, Adventure, Comedy",Andy Tennant,"Matthew McConaughey, Kate Hudson, Donald Sutherland, Alexis Dziena",36.0,43.0,22.0,101.0
The Kingdom,2007-09-28,72500000.0,R,110,"Action, Drama, Thriller",Peter Berg,"Jamie Foxx, Chris Cooper, Jennifer Garner, Jason Bateman",51.0,289.0,33.0,373.0
Funny People,2009-07-31,72500000.0,R,146,"Comedy, Drama",Judd Apatow,"Adam Sandler, Seth Rogen, Leslie Mann, Eric Bana",31.0,124.0,21.0,176.0
The Majestic,2001-12-21,72000000.0,PG,152,"Drama, Romance",Frank Darabont,"Jim Carrey, Bob Balaban, Jeffrey DeMunn, Hal Holbrook",9.0,48.0,13.0,70.0
Driven,2001-04-27,72000000.0,PG-13,116,"Action, Drama, Sport",Renny Harlin,"Sylvester Stallone, Burt Reynolds, Kip Pardue, Stacy Edwards",11.0,35.0,20.0,66.0
Jarhead,2005-11-04,72000000.0,R,125,"Action, Drama, War",Sam Mendes,"Jake Gyllenhaal, Scott MacDonald, Peter Sarsgaard, Jamie Foxx",35.0,91.0,24.0,150.0
Two Brothers,2004-06-25,72000000.0,PG,109,"Adventure, Drama, Family",Jean-Jacques Annaud,"Guy Pearce, Jean-Claude Dreyfus, Freddie Highmore, Oanh Nguyen",8.0,20.0,21.0,49.0
Braveheart,1995-05-24,72000000.0,R,178,"Biography, Drama, History",Mel Gibson,"James Robinson, Sean Lawlor, Sandy Nelson, James Cosmo",65.0,245.0,61.0,371.0
The Village,2004-07-30,71682975.0,PG-13,108,"Drama, Mystery, Romance",M. Night Shyamalan,"Bryce Dallas Howard, Joaquin Phoenix, Adrien Brody, William Hurt",21.0,88.0,28.0,137.0
Doctor Dolittle,1998-06-26,71500000.0,PG-13,85,"Comedy, Family, Fantasy",Betty Thomas,"Eddie Murphy, Ossie Davis, Oliver Platt, Peter Boyle",12.0,18.0,13.0,43.0
Ransom,1996-11-08,70000000.0,R,121,"Crime, Thriller",Ron Howard,"Mel Gibson, Rene Russo, Brawley Nolte, Gary Sinise",13.0,34.0,21.0,68.0
The Finest Hours,2016-01-29,70000000.0,PG-13,117,"Action, Drama, History",Craig Gillespie,"Chris Pine, Casey Affleck, Ben Foster, Eric Bana",32.0,175.0,214.0,421.0
Hook,1991-12-11,70000000.0,PG,142,"Adventure, Comedy, Family",Steven Spielberg,"Dustin Hoffman, Robin Williams, Julia Roberts, Bob Hoskins",33.0,86.0,27.0,146.0
Sky Captain and the World of Tomorrow,2004-09-17,70000000.0,PG,106,"Action, Adventure, Mystery",Kerry Conran,"Gwyneth Paltrow, Jude Law, Giovanni Ribisi, Michael Gambon",34.0,69.0,15.0,118.0
Basic Instinct 2,2006-03-31,70000000.0,R,114,"Crime, Mystery, Thriller",Michael Caton-Jones,"Stan Collymore, Sharon Stone, Neil Maskell, David Thewlis",24.0,66.0,17.0,107.0
Runaway Bride,1999-07-30,70000000.0,PG,116,"Comedy, Romance",Garry Marshall,"Julia Roberts, Richard Gere, Joan Cusack, Hector Elizondo",8.0,35.0,22.0,65.0
Blackhat,2015-01-16,70000000.0,R,133,"Action, Crime, Drama",Michael Mann,"Chris Hemsworth, Leehom Wang, Wei Tang, Viola Davis",38.0,184.0,85.0,307.0
Rock of Ages,2012-06-15,70000000.0,PG-13,123,"Comedy, Drama, Musical",Adam Shankman,"Julianne Hough, Dakota Sage Grant, Matthew Rush Sullivan, Diego Boneta",68.0,232.0,18.0,318.0
Dracula Untold,2014-10-10,70000000.0,PG-13,92,"Action, Drama, Fantasy",Gary Shore,"Luke Evans, Sarah Gadon, Dominic Cooper, Art Parkinson",79.0,370.0,23.0,472.0
Olympus Has Fallen,2013-03-22,70000000.0,R,119,"Action, Thriller",Antoine Fuqua,"Gerard Butler, Aaron Eckhart, Finley Jacobsen, Dylan McDermott",128.0,283.0,41.0,452.0
The Monuments Men,2014-02-07,70000000.0,PG-13,118,"Drama, War",George Clooney,"George Clooney, Matt Damon, Bill Murray, Cate Blanchett",106.0,280.0,16.0,402.0
Hart's War,2002-02-15,70000000.0,R,125,"Drama, War",Gregory Hoblit,"Bruce Willis, Colin Farrell, Terrence Howard, Cole Hauser",21.0,23.0,17.0,61.0
Shrek 2,2004-05-19,70000000.0,PG,93,"Animation, Adventure, Comedy","Andrew Adamson, Kelly Asbury, Conrad Vernon","Mike Myers, Eddie Murphy, Cameron Diaz, Julie Andrews",34.0,97.0,22.0,153.0
The Dilemma,2011-01-14,70000000.0,PG-13,111,"Comedy, Drama",Ron Howard,"Vince Vaughn, Kevin James, Jennifer Connelly, Winona Ryder",75.0,174.0,18.0,267.0
The Abyss,1989-08-09,70000000.0,PG-13,145,"Adventure, Drama, Sci-Fi",James Cameron,"Ed Harris, Mary Elizabeth Mastrantonio, Michael Biehn, Leo Burmester",42.0,102.0,30.0,174.0
The Siege,1998-11-06,70000000.0,R,116,"Action, Thriller",Edward Zwick,"Denzel Washington, Annette Bening, Bruce Willis, Tony Shalhoub",24.0,69.0,20.0,113.0
We Were Soldiers,2002-03-01,70000000.0,R,138,"Action, Drama, History",Randall Wallace,"Mel Gibson, Madeleine Stowe, Greg Kinnear, Sam Elliott",47.0,115.0,23.0,185.0
Cars,2006-06-09,70000000.0,G,117,"Animation, Adventure, Comedy","John Lasseter, Joe Ranft","Owen Wilson, Paul Newman, Bonnie Hunt, Larry the Cable Guy",91.0,357.0,25.0,473.0
I Spy,2002-11-01,70000000.0,PG-13,97,"Action, Adventure, Comedy",Betty Thomas,"Eddie Murphy, Owen Wilson, Famke Janssen, Malcolm McDowell",11.0,31.0,23.0,65.0
Escape Plan,2013-10-18,70000000.0,R,115,"Action, Mystery, Thriller",Mikael Håfström,"Sylvester Stallone, Arnold Schwarzenegger, Jim Caviezel, Faran Tahir",123.0,672.0,13.0,808.0
Rollerball,2002-02-08,70000000.0,R,98,"Action, Sci-Fi, Sport",John McTiernan,"Chris Klein, Jean Reno, LL Cool J, Rebecca Romijn",6.0,32.0,15.0,53.0
Killer Elite,2011-09-23,70000000.0,R,116,"Action, Crime, Thriller",Gary McKendry,"Jason Statham, Clive Owen, Robert De Niro, Dominic Purcell",129.0,331.0,27.0,487.0
S.W.A.T.,2003-08-08,70000000.0,PG-13,117,"Action, Adventure, Crime",Clark Johnson,"Samuel L. Jackson, Colin Farrell, Michelle Rodriguez, LL Cool J",22.0,82.0,25.0,129.0
Hard Rain,1998-01-16,70000000.0,R,97,"Action, Crime, Drama",Mikael Salomon,"Morgan Freeman, Christian Slater, Randy Quaid, Minnie Driver",13.0,44.0,24.0,81.0
Doom,2005-10-21,70000000.0,R,105,"Action, Adventure, Horror",Andrzej Bartkowiak,"Karl Urban, Rosamund Pike, Deobia Oparei, Ben Daniels",52.0,236.0,31.0,319.0
Sleepy Hollow,1999-11-19,70000000.0,R,105,"Drama, Horror, Mystery",Tim Burton,"Johnny Depp, Christina Ricci, Miranda Richardson, Michael Gambon",47.0,150.0,51.0,248.0
War Horse,2011-12-25,70000000.0,PG-13,146,"Drama, War",Steven Spielberg,"Jeremy Irvine, Peter Mullan, Emily Watson, Niels Arestrup",113.0,250.0,38.0,401.0
Stardust,2007-08-10,70000000.0,PG-13,127,"Adventure, Family, Fantasy",Matthew Vaughn,"Ian McKellen, Bimbo Hart, Alastair MacIntosh, David Kelly",63.0,173.0,30.0,266.0
Bad Company,2002-06-07,70000000.0,PG-13,116,"Action, Adventure, Comedy",Joel Schumacher,"Anthony Hopkins, Chris Rock, Peter Stormare, Gabriel Macht",9.0,43.0,13.0,65.0
Despicable Me,2010-07-09,69000000.0,PG,95,"Animation, Comedy, Family","Pierre Coffin, Chris Renaud","Steve Carell, Jason Segel, Russell Brand, Julie Andrews",185.0,328.0,41.0,554.0
Dinner for Schmucks,2010-07-30,69000000.0,PG-13,114,Comedy,Jay Roach,"Steve Carell, Paul Rudd, Zach Galifianakis, Jemaine Clement",76.0,126.0,17.0,219.0
Hall Pass,2011-02-25,68000000.0,R,105,"Comedy, Romance","Bobby Farrelly, Peter Farrelly","Owen Wilson, Jason Sudeikis, Jenna Fischer, Christina Applegate",84.0,223.0,21.0,328.0
The Sum of All Fears,2002-05-31,68000000.0,PG-13,124,"Action, Drama, Thriller",Phil Alden Robinson,"Ian Mongrain, Russell Bobbitt, James Cromwell, Ken Jenkins",26.0,61.0,18.0,105.0
Dreamcatcher,2003-03-21,68000000.0,R,134,"Drama, Horror, Sci-Fi",Lawrence Kasdan,"Morgan Freeman, Thomas Jane, Jason Lee, Damian Lewis",27.0,70.0,27.0,124.0
Money Train,1995-11-22,68000000.0,R,110,"Action, Comedy, Crime",Joseph Ruben,"Wesley Snipes, Woody Harrelson, Jennifer Lopez, Robert Blake",12.0,43.0,26.0,81.0
The Insider,1999-11-05,68000000.0,R,157,"Biography, Drama, Thriller",Michael Mann,"Al Pacino, Russell Crowe, Christopher Plummer, Diane Venora",27.0,79.0,29.0,135.0
The Score,2001-07-13,68000000.0,R,124,"Crime, Drama, Thriller",Frank Oz,"Robert De Niro, Edward Norton, Marlon Brando, Angela Bassett",24.0,78.0,19.0,121.0
Ted 2,2015-06-26,68000000.0,R,115,Comedy,Seth MacFarlane,"Mark Wahlberg, Seth MacFarlane, Amanda Seyfried, Jessica Barth",74.0,348.0,93.0,515.0
Body of Lies,2008-10-10,67500000.0,R,128,"Action, Drama, Thriller",Ridley Scott,"Leonardo DiCaprio, Russell Crowe, Mark Strong, Golshifteh Farahani",71.0,263.0,46.0,380.0
Last Man Standing,1996-09-20,67000000.0,R,101,"Action, Crime, Drama",Walter Hill,"Bruce Willis, Bruce Dern, William Sanderson, Christopher Walken",23.0,73.0,30.0,126.0
The Last Legion,2007-08-17,67000000.0,PG-13,102,"Action, Adventure, Fantasy",Doug Lefler,"Colin Firth, Ben Kingsley, Aishwarya Rai Bachchan, Peter Mullan",34.0,114.0,19.0,167.0
Need for Speed,2014-03-14,66000000.0,PG-13,132,"Action, Crime, Drama",Scott Waugh,"Aaron Paul, Dominic Cooper, Imogen Poots, Scott Mescudi",163.0,499.0,18.0,680.0
Entrapment,1999-04-30,66000000.0,PG-13,113,"Action, Crime, Romance",Jon Amiel,"Sean Connery, Catherine Zeta-Jones, Ving Rhames, Will Patton",24.0,75.0,27.0,126.0
"I, Frankenstein",2014-01-24,65000000.0,PG-13,92,"Action, Fantasy, Sci-Fi",Stuart Beattie,"Aaron Eckhart, Yvonne Strahovski, Miranda Otto, Bill Nighy",120.0,347.0,43.0,510.0
Step Brothers,2008-07-25,65000000.0,R,98,Comedy,Adam McKay,"Will Ferrell, John C. Reilly, Mary Steenburgen, Richard Jenkins",54.0,88.0,18.0,160.0
You've Got Mail,1998-12-18,65000000.0,PG,119,"Comedy, Drama, Romance",Nora Ephron,"Tom Hanks, Meg Ryan, Greg Kinnear, Parker Posey",27.0,32.0,25.0,84.0
Space Cowboys,2000-08-04,65000000.0,PG-13,130,"Action, Adventure, Thriller",Clint Eastwood,"Clint Eastwood, Tommy Lee Jones, Donald Sutherland, James Garner",15.0,57.0,14.0,86.0
The Mask of Zorro,1998-07-17,65000000.0,PG-13,136,"Action, Adventure, Comedy",Martin Campbell,"José María de Tavira, Diego Sieres, Emiliano Guerra, Yolanda Orisaga",15.0,38.0,27.0,80.0
Zathura,2005-11-11,65000000.0,PG,101,"Action, Adventure, Comedy",Jon Favreau,"Jonah Bobo, Josh Hutcherson, Dax Shepard, Kristen Stewart",29.0,83.0,12.0,124.0
What Women Want,2000-12-15,65000000.0,PG-13,127,"Comedy, Fantasy, Romance",Nancy Meyers,"Mel Gibson, Helen Hunt, Marisa Tomei, Alan Alda",15.0,48.0,22.0,85.0
Fight Club,1999-10-15,65000000.0,R,139,Drama,David Fincher,"Edward Norton, Brad Pitt, Meat Loaf, Zach Grenier",100.0,298.0,76.0,474.0
Due Date,2010-11-05,65000000.0,R,95,"Adventure, Comedy",Todd Phillips,"Robert Downey Jr., Zach Galifianakis, Michelle Monaghan, Jamie Foxx",131.0,203.0,35.0,369.0
World Trade Center,2006-08-09,65000000.0,PG-13,129,"Drama, History, Thriller",Oliver Stone,"Nicolas Cage, Maria Bello, Connor Paolo, Anthony Piccininni",28.0,108.0,21.0,157.0
Death Race,2008-08-22,65000000.0,R,105,"Action, Sci-Fi, Thriller",Paul W.S. Anderson,"Jason Statham, Joan Allen, Ian McShane, Tyrese Gibson",100.0,442.0,40.0,582.0
The Long Kiss Goodnight,1996-10-11,65000000.0,R,121,"Action, Crime, Drama",Renny Harlin,"Geena Davis, Samuel L. Jackson, Yvonne Zima, Craig Bierko",20.0,58.0,27.0,105.0
Broken Arrow,1996-02-09,65000000.0,R,108,"Action, Crime, Thriller",John Woo,"John Travolta, Christian Slater, Samantha Mathis, Delroy Lindo",17.0,83.0,21.0,121.0
This Means War,2012-02-17,65000000.0,PG-13,103,"Action, Comedy, Romance",McG,"Reese Witherspoon, Chris Pine, Tom Hardy, Til Schweiger",97.0,267.0,44.0,408.0
Elektra,2005-01-14,65000000.0,PG-13,97,"Action, Crime, Fantasy",Rob Bowman,"Jennifer Garner, Goran Visnjic, Kirsten Prout, Will Yun Lee",32.0,109.0,39.0,180.0
Mona Lisa Smile,2003-12-19,65000000.0,PG-13,117,Drama,Mike Newell,"Julia Roberts, Kirsten Dunst, Julia Stiles, Maggie Gyllenhaal",16.0,39.0,19.0,74.0
Unbroken,2014-12-25,65000000.0,PG-13,137,"Biography, Drama, Sport",Angelina Jolie,"Jack O'Connell, Domhnall Gleeson, Garrett Hedlund, Miyavi",35.0,172.0,42.0,249.0
Saving Private Ryan,1998-07-24,65000000.0,R,169,"Action, Drama, War",Steven Spielberg,"Tom Hanks, Tom Sizemore, Edward Burns, Barry Pepper",79.0,220.0,62.0,361.0
Focus,2015-02-27,65000000.0,R,105,"Comedy, Crime, Drama","Glenn Ficarra, John Requa","Will Smith, Margot Robbie, Adrian Martinez, Gerald McRaney",54.0,344.0,139.0,537.0
Hudson Hawk,1991-05-24,65000000.0,R,100,"Action, Adventure, Comedy",Michael Lehmann,"Bruce Willis, Danny Aiello, Andie MacDowell, James Coburn",17.0,55.0,34.0,106.0
Eyes Wide Shut,1999-07-16,65000000.0,R,159,"Drama, Mystery, Thriller",Stanley Kubrick,"Tom Cruise, Nicole Kidman, Sydney Pollack, Marie Richardson",34.0,104.0,20.0,158.0
Total Recall,1990-06-01,65000000.0,R,113,"Action, Sci-Fi",Paul Verhoeven,"Arnold Schwarzenegger, Rachel Ticotin, Sharon Stone, Ronny Cox",74.0,180.0,50.0,304.0
Annie,2014-12-19,65000000.0,PG,118,"Comedy, Drama, Family",Will Gluck,"Jamie Foxx, Quvenzhané Wallis, Rose Byrne, Bobby Cannavale",23.0,104.0,28.0,155.0
Proof of Life,2000-12-08,65000000.0,R,135,"Action, Drama, Thriller",Taylor Hackford,"Meg Ryan, Russell Crowe, David Morse, Pamela Reed",10.0,34.0,13.0,57.0
The Missing,2003-11-26,65000000.0,R,137,"Adventure, Thriller, Western",Ron Howard,"Tommy Lee Jones, Cate Blanchett, Evan Rachel Wood, Jenna Boyd",8.0,41.0,15.0,64.0
Jumanji,1995-12-15,65000000.0,PG,104,"Adventure, Family, Fantasy",Joe Johnston,"Robin Williams, Jonathan Hyde, Kirsten Dunst, Bradley Pierce",41.0,108.0,37.0,186.0
Ice Age,2002-03-15,65000000.0,PG,81,"Animation, Adventure, Comedy","Chris Wedge, Carlos Saldanha","Ray Romano, John Leguizamo, Denis Leary, Goran Visnjic",60.0,174.0,24.0,258.0
Random Hearts,1999-10-08,64000000.0,R,133,"Drama, Mystery, Romance",Sydney Pollack,"Harrison Ford, Kristin Scott Thomas, Charles S. Dutton, Bonnie Hunt",7.0,11.0,10.0,28.0
Hop,2011-04-01,63000000.0,PG,95,"Animation, Adventure, Comedy",Tim Hill,"James Marsden, Russell Brand, Kaley Cuoco, Hank Azaria",90.0,957.0,19.0,1066.0
Jurassic Park,1993-06-11,63000000.0,PG-13,127,"Adventure, Sci-Fi, Thriller",Steven Spielberg,"Sam Neill, Laura Dern, Jeff Goldblum, Richard Attenborough",86.0,230.0,62.0,378.0
Clear and Present Danger,1994-08-03,62000000.0,PG-13,141,"Action, Crime, Drama",Phillip Noyce,"Harrison Ford, Willem Dafoe, Anne Archer, Joaquim de Almeida",22.0,62.0,18.0,102.0
The Love Guru,2008-06-20,62000000.0,PG-13,87,"Comedy, Romance, Sport",Marco Schnabel,"Jessica Simpson, Kanye West, Mike Myers, Deepak Chopra",28.0,101.0,13.0,142.0
U-571,2000-04-21,62000000.0,PG-13,116,"Action, War",Jonathan Mostow,"Matthew McConaughey, Bill Paxton, Harvey Keitel, Jon Bon Jovi",28.0,108.0,30.0,166.0
Blades of Glory,2007-03-30,61000000.0,PG-13,93,"Comedy, Sport","Josh Gordon, Will Speck","Will Ferrell, Jon Heder, Will Arnett, Amy Poehler",28.0,95.0,16.0,139.0
2 Guns,2013-08-02,61000000.0,R,109,"Action, Comedy, Crime",Baltasar Kormákur,"Denzel Washington, Mark Wahlberg, Paula Patton, Edward James Olmos",66.0,296.0,41.0,403.0
Gone Girl,2014-10-03,61000000.0,R,149,"Crime, Drama, Mystery",David Fincher,"Ben Affleck, Rosamund Pike, Neil Patrick Harris, Tyler Perry",18.0,258.0,78.0,354.0
The Horse Whisperer,1998-05-15,60000000.0,PG-13,170,"Drama, Romance, Western",Robert Redford,"Robert Redford, Kristin Scott Thomas, Sam Neill, Dianne Wiest",15.0,36.0,13.0,64.0
Any Given Sunday,1999-12-22,60000000.0,R,162,"Drama, Sport",Oliver Stone,"Al Pacino, Cameron Diaz, Dennis Quaid, James Woods",17.0,62.0,23.0,102.0
Year One,2009-06-19,60000000.0,PG-13,97,"Adventure, Comedy",Harold Ramis,"Jack Black, Michael Cera, Oliver Platt, David Cross",36.0,109.0,39.0,184.0
Days of Thunder,1990-06-27,60000000.0,PG-13,107,"Action, Drama, Sport",Tony Scott,"Tom Cruise, Nicole Kidman, Robert Duvall, Randy Quaid",18.0,76.0,22.0,116.0
Supernova,2000-01-14,60000000.0,PG-13,90,"Horror, Sci-Fi, Thriller",Walter Hill,"James Spader, Angela Bassett, Robert Forster, Lou Diamond Phillips",9.0,32.0,17.0,58.0
State of Play,2009-04-17,60000000.0,PG-13,127,"Crime, Drama, Mystery",Kevin Macdonald,"Russell Crowe, Ben Affleck, Rachel McAdams, Helen Mirren",49.0,219.0,27.0,295.0
London Has Fallen,2016-03-04,60000000.0,R,99,"Action, Crime, Drama",Babak Najafi,"Alon Aboutboul, Waleed Zuaiter, Adel Bencherif, Mehdi Dehbi",68.0,294.0,267.0,629.0
Starsky & Hutch,2004-03-05,60000000.0,PG-13,101,"Comedy, Crime",Todd Phillips,"Ben Stiller, Owen Wilson, Snoop Dogg, Fred Williamson",31.0,159.0,32.0,222.0
Man on Fire,2004-04-23,60000000.0,R,146,"Action, Crime, Drama",Tony Scott,"Denzel Washington, Dakota Fanning, Radha Mitchell, Christopher Walken",52.0,164.0,40.0,256.0
Dragonfly,2002-02-22,60000000.0,PG-13,104,"Drama, Fantasy, Mystery",Tom Shadyac,"Kevin Costner, Susanna Thompson, Joe Morton, Ron Rifkin",6.0,27.0,16.0,49.0
Meet the Fockers,2004-12-22,60000000.0,PG-13,115,"Comedy, Romance",Jay Roach,"Robert De Niro, Ben Stiller, Dustin Hoffman, Barbra Streisand",20.0,51.0,20.0,91.0
Priest,2011-05-13,60000000.0,PG-13,87,"Action, Fantasy, Horror",Scott Stewart,"Paul Bettany, Karl Urban, Cam Gigandet, Maggie Q",139.0,320.0,31.0,490.0
Event Horizon,1997-08-15,60000000.0,R,96,"Horror, Sci-Fi, Thriller",Paul W.S. Anderson,"Laurence Fishburne, Sam Neill, Kathleen Quinlan, Joely Richardson",30.0,112.0,31.0,173.0
Trouble with the Curve,2012-09-21,60000000.0,PG-13,111,"Drama, Sport",Robert Lorenz,"Clint Eastwood, Chelcie Ross, Raymond Anthony Thomas, Ed Lauter",52.0,143.0,19.0,214.0
Daddy Day Care,2003-05-09,60000000.0,PG,92,"Comedy, Family",Steve Carr,"Eddie Murphy, Jeff Garlin, Steve Zahn, Regina King",9.0,20.0,14.0,43.0
Winter's Tale,2014-02-14,60000000.0,PG-13,118,"Drama, Fantasy, Mystery",Akiva Goldsman,"Colin Farrell, Matt Bomer, Lucy Griffiths, Michael Crane",95.0,75.0,20.0,190.0
Hellboy,2004-04-02,60000000.0,PG-13,122,"Action, Fantasy, Horror",Guillermo del Toro,"Ron Perlman, John Hurt, Selma Blair, Rupert Evans",53.0,142.0,44.0,239.0
Ladder 49,2004-10-01,60000000.0,PG-13,115,"Action, Drama, Thriller",Jay Russell,"Joaquin Phoenix, John Travolta, Jacinda Barrett, Robert Patrick",24.0,58.0,12.0,94.0
The Last Castle,2001-10-19,60000000.0,R,131,"Action, Drama, Thriller",Rod Lurie,"Robert Redford, James Gandolfini, Mark Ruffalo, Steve Burton",13.0,29.0,20.0,62.0
Dark Water,2005-07-08,60000000.0,PG-13,105,"Drama, Horror, Thriller",Walter Salles,"Jennifer Connelly, John C. Reilly, Tim Roth, Dougray Scott",13.0,67.0,18.0,98.0
Two Weeks Notice,2002-12-20,60000000.0,PG-13,101,"Comedy, Romance",Marc Lawrence,"Sandra Bullock, Hugh Grant, Alicia Witt, Dana Ivey",15.0,40.0,20.0,75.0
Deep Blue Sea,1999-07-28,60000000.0,R,105,"Action, Sci-Fi, Thriller",Renny Harlin,"Thomas Jane, Saffron Burrows, Samuel L. Jackson, Jacqueline McKenzie",31.0,99.0,30.0,160.0
The Green Mile,1999-12-10,60000000.0,R,189,"Crime, Drama, Fantasy",Frank Darabont,"Tom Hanks, David Morse, Michael Clarke Duncan, Bonnie Hunt",64.0,192.0,47.0,303.0
Beyond Borders,2003-10-24,60000000.0,R,127,"Adventure, Drama, Romance",Martin Campbell,"Angelina Jolie, Clive Owen, Teri Polo, Linus Roache",12.0,32.0,17.0,61.0
Duplicity,2009-03-20,60000000.0,PG-13,125,"Crime, Romance, Thriller",Tony Gilroy,"Clive Owen, Julia Roberts, Tom Wilkinson, Paul Giamatti",52.0,269.0,21.0,342.0
Mercury Rising,1998-04-03,60000000.0,R,111,"Action, Crime, Drama",Harold Becker,"Bruce Willis, Alec Baldwin, Miko Hughes, Chi McBride",15.0,58.0,21.0,94.0
The Ridiculous 6,2015-12-11,60000000.0,TV-14,119,"Comedy, Western",Frank Coraci,"Adam Sandler, Terry Crews, Jorge Garcia, Taylor Lautner",17.0,70.0,37.0,124.0
Shooter,2007-03-23,60000000.0,R,124,"Action, Crime, Drama",Antoine Fuqua,"Mark Wahlberg, Michael Peña, Danny Glover, Kate Mara",76.0,365.0,53.0,494.0
Rules of Engagement,2000-04-07,60000000.0,R,128,"Drama, Thriller, War",William Friedkin,"Tommy Lee Jones, Samuel L. Jackson, Guy Pearce, Ben Kingsley",16.0,33.0,13.0,62.0
The Relic,1997-01-10,60000000.0,R,110,"Horror, Mystery, Sci-Fi",Peter Hyams,"Penelope Ann Miller, Tom Sizemore, Linda Hunt, James Whitmore",11.0,16.0,11.0,38.0
Joy,2015-12-25,60000000.0,PG-13,124,"Biography, Comedy, Drama",David O. Russell,"Jennifer Lawrence, Robert De Niro, Bradley Cooper, Edgar Ramírez",37.0,740.0,164.0,941.0
Intolerable Cruelty,2003-10-10,60000000.0,PG-13,100,"Comedy, Crime, Romance","Joel Coen, Ethan Coen","George Clooney, Catherine Zeta-Jones, Geoffrey Rush, Cedric the Entertainer",16.0,33.0,22.0,71.0
The Soloist,2009-04-24,60000000.0,PG-13,117,"Biography, Drama, Music",Joe Wright,"Jamie Foxx, Robert Downey Jr., Catherine Keener, Tom Hollander",33.0,154.0,16.0,203.0
Mortdecai,2015-01-23,60000000.0,R,107,"Action, Comedy, Mystery",David Koepp,"Johnny Depp, Gwyneth Paltrow, Paul Bettany, Ewan McGregor",24.0,85.0,55.0,164.0
Flyboys,2006-09-22,60000000.0,PG-13,140,"Action, Adventure, Drama",Tony Bill,"James Franco, Scott Hazell, Mac McDonald, Philip Winchester",21.0,81.0,22.0,124.0
The Avengers,1998-08-14,60000000.0,PG-13,89,"Action, Adventure, Sci-Fi",Jeremiah S. Chechik,"Ralph Fiennes, Uma Thurman, Sean Connery, Patrick Macnee",12.0,33.0,11.0,56.0
Holy Man,1998-10-09,60000000.0,PG,114,"Comedy, Drama",Stephen Herek,"Eddie Murphy, Jeff Goldblum, Kelly Preston, Robert Loggia",4.0,15.0,14.0,33.0
Paycheck,2003-12-25,60000000.0,PG-13,119,"Action, Mystery, Sci-Fi",John Woo,"Ben Affleck, Aaron Eckhart, Uma Thurman, Paul Giamatti",34.0,101.0,32.0,167.0
The Sentinel,2006-04-21,60000000.0,PG-13,108,"Action, Crime, Thriller",Clark Johnson,"Michael Douglas, Kiefer Sutherland, Eva Longoria, Martin Donovan",22.0,73.0,26.0,121.0
The Truman Show,1998-06-05,60000000.0,PG,103,Drama,Peter Weir,"Jim Carrey, Laura Linney, Noah Emmerich, Natascha McElhone",46.0,108.0,45.0,199.0
Contagion,2011-09-09,60000000.0,PG-13,106,"Drama, Thriller",Steven Soderbergh,"Gwyneth Paltrow, Tien You Chui, Josie Ho, Daria Strokous",104.0,267.0,31.0,402.0
The Spirit,2008-12-25,60000000.0,PG-13,103,"Action, Crime, Fantasy",Frank Miller,"Jaime King, Gabriel Macht, Dan Gerrity, Arthur the Cat",53.0,307.0,25.0,385.0
Eat Pray Love,2010-08-13,60000000.0,PG-13,133,"Drama, Romance",Ryan Murphy,"Julia Roberts, I. Gusti Ayu Puspawati, Hadi Subiyanto, Billy Crudup",65.0,95.0,19.0,179.0
The Family Man,2000-12-22,60000000.0,PG-13,125,"Comedy, Drama, Fantasy",Brett Ratner,"Nicolas Cage, Téa Leoni, Don Cheadle, Jeremy Piven",12.0,45.0,37.0,94.0
The Lego Movie,2014-02-07,60000000.0,PG,100,"Animation, Action, Adventure","Phil Lord, Christopher Miller","Will Arnett, Elizabeth Banks, Craig Berry, Alison Brie",150.0,472.0,19.0,641.0
The Jackal,1997-11-14,60000000.0,R,124,"Action, Adventure, Crime",Michael Caton-Jones,"Bruce Willis, Richard Gere, Sidney Poitier, Diane Venora",29.0,106.0,27.0,162.0
The Scorpion King,2002-04-19,60000000.0,PG-13,92,"Action, Adventure, Fantasy",Chuck Russell,"Dwayne Johnson, Steven Brand, Michael Clarke Duncan, Kelly Hu",25.0,76.0,18.0,119.0
The Legend of Bagger Vance,2000-11-03,60000000.0,PG-13,126,"Drama, Fantasy, Sport",Robert Redford,"Will Smith, Matt Damon, Charlize Theron, Bruce McGill",6.0,20.0,13.0,39.0
Collateral,2004-08-06,60000000.0,R,120,"Crime, Drama, Thriller",Michael Mann,"Tom Cruise, Jamie Foxx, Jada Pinkett Smith, Mark Ruffalo",43.0,133.0,40.0,216.0
Invictus,2009-12-11,60000000.0,PG-13,134,"Biography, Drama, History",Clint Eastwood,"Morgan Freeman, Matt Damon, Tony Kgoroge, Patrick Mofokeng",59.0,153.0,14.0,226.0
Gangster Squad,2013-01-11,60000000.0,R,113,"Action, Crime, Drama",Ruben Fleischer,"Sean Penn, Holt McCallany, Wade Williams, James Landry Hébert",144.0,405.0,25.0,574.0
Jingle All the Way,1996-11-22,60000000.0,PG,89,"Comedy, Family",Brian Levant,"Arnold Schwarzenegger, Sinbad, Phil Hartman, Rita Wilson",22.0,60.0,20.0,102.0
My Favorite Martian,1999-02-12,60000000.0,PG,94,"Comedy, Family, Sci-Fi",Donald Petrie,"Christopher Lloyd, Jeff Daniels, Elizabeth Hurley, Daryl Hannah",3.0,10.0,17.0,30.0
Practical Magic,1998-10-16,60000000.0,PG-13,104,"Comedy, Drama, Fantasy",Griffin Dunne,"Sandra Bullock, Nicole Kidman, Stockard Channing, Dianne Wiest",7.0,44.0,17.0,68.0
Couples Retreat,2009-10-09,60000000.0,PG-13,113,Comedy,Peter Billingsley,"Vince Vaughn, Jason Bateman, Faizon Love, Jon Favreau",45.0,145.0,23.0,213.0
