Title,Released,Prod_Budget,Dom_Gross,World_Gross,Rated,Runtime,Genre,Director,Actors,Pirate_Count,Torrentz_Count,Zoogle_Ver_Count,Year,Month,Total_Torrents
Let Me In,2010-10-01,20000000.0,12134935.0,28270399.0,R,116,"Drama, Fantasy, Horror",Matt Reeves,"Kodi Smit-McPhee, Chloë Grace Moretz, Richard Jenkins, Cara Buono",84.0,164.0,26.0,2010.0,10.0,274.0
Endless Love,2014-02-14,20000000.0,23438250.0,34614964.0,PG-13,104,"Drama, Romance",Shana Feste,"Alex Pettyfer, Gabriella Wilde, Bruce Greenwood, Joely Richardson",46.0,147.0,16.0,2014.0,2.0,209.0
Fired Up,2009-02-20,20000000.0,17231291.0,18608570.0,PG-13,90,Comedy,Will Gluck,"Nicholas D'Agosto, Eric Christian Olsen, Sarah Roemer, Molly Sims",42.0,182.0,13.0,2009.0,2.0,237.0
Death Sentence,2007-08-31,20000000.0,9534258.0,16907831.0,R,105,"Action, Crime, Thriller",James Wan,"Kevin Bacon, Garrett Hedlund, Kelly Preston, Jordan Garrett",37.0,182.0,23.0,2007.0,8.0,242.0
A Guy Thing,2003-01-17,20000000.0,15543862.0,17430594.0,PG-13,101,"Comedy, Romance",Chris Koch,"Jason Lee, Julia Stiles, Selma Blair, James Brolin",8.0,17.0,17.0,2003.0,1.0,42.0
You Again,2010-09-24,20000000.0,25702053.0,32838945.0,PG,105,"Comedy, Family, Romance",Andy Fickman,"Kristen Bell, Jamie Lee Curtis, Sigourney Weaver, Odette Annable",50.0,118.0,33.0,2010.0,9.0,201.0
Drumline,2002-12-13,20000000.0,56398162.0,56398162.0,PG-13,118,"Comedy, Drama, Romance",Charles Stone III,"Nick Cannon, Zoe Saldana, Orlando Jones, Leonard Roberts",5.0,27.0,15.0,2002.0,12.0,47.0
The American,2010-09-01,20000000.0,35606376.0,67950723.0,R,105,"Crime, Drama, Thriller",Anton Corbijn,"George Clooney, Irina Björklund, Lars Hjelm, Björn Granath",99.0,281.0,34.0,2010.0,9.0,414.0
Be Kind Rewind,2008-02-22,20000000.0,11175164.0,30894247.0,PG-13,102,Comedy,Michel Gondry,"Jack Black, Yasiin Bey, Danny Glover, Mia Farrow",28.0,105.0,15.0,2008.0,2.0,148.0
One Night with the King,2006-10-13,20000000.0,13395961.0,13725032.0,PG,123,"Biography, Drama, History",Michael O. Sajbel,"Tiffany Dupont, Luke Goss, John Noble, Omar Sharif",5.0,26.0,14.0,2006.0,10.0,45.0
Obsessed,2009-04-24,20000000.0,68261644.0,73964713.0,PG-13,108,"Drama, Romance, Thriller",Steve Shill,"Idris Elba, Beyoncé Knowles, Ali Larter, Jerry O'Connell",30.0,150.0,10.0,2009.0,4.0,190.0
Triple 9,2016-02-26,20000000.0,12639297.0,22690380.0,R,115,"Action, Crime, Drama",John Hillcoat,"Chiwetel Ejiofor, Casey Affleck, Anthony Mackie, Woody Harrelson",34.0,185.0,19.0,2016.0,2.0,238.0
Ghost Town,2008-09-19,20000000.0,13252641.0,29843245.0,PG-13,102,"Comedy, Drama, Fantasy",David Koepp,"Greg Kinnear, Jordan Carlos, Dequina Moore, Joseph Badalucco Jr.",56.0,173.0,20.0,2008.0,9.0,249.0
Me Before You,2016-06-03,20000000.0,54085778.0,137085778.0,PG-13,110,"Drama, Romance",Thea Sharrock,"Sam Claflin, Emilia Clarke, Vanessa Kirby, Eileen Dunwoodie",10.0,55.0,51.0,2016.0,6.0,116.0
Bandslam,2009-08-14,20000000.0,5210988.0,12967829.0,PG,111,"Comedy, Drama, Family",Todd Graff,"Aly Michalka, Vanessa Hudgens, Gaelan Connell, Scott Porter",18.0,45.0,11.0,2009.0,8.0,74.0
Wild Things,1998-03-20,20000000.0,29795299.0,55576699.0,R,108,"Crime, Drama, Mystery",John McNaughton,"Kevin Bacon, Matt Dillon, Neve Campbell, Theresa Russell",21.0,65.0,28.0,1998.0,3.0,114.0
Vampires,1998-10-30,20000000.0,20268825.0,20268825.0,R,108,"Action, Horror, Thriller",John Carpenter,"James Woods, Daniel Baldwin, Sheryl Lee, Thomas Ian Griffith",24.0,77.0,19.0,1998.0,10.0,120.0
Lakeview Terrace,2008-09-19,20000000.0,39263506.0,44821299.0,PG-13,110,"Crime, Drama, Thriller",Neil LaBute,"Samuel L. Jackson, Patrick Wilson, Kerry Washington, Ron Glass",48.0,230.0,13.0,2008.0,9.0,291.0
Undisputed,2002-08-23,20000000.0,12398628.0,12398628.0,R,94,"Action, Crime, Drama",Walter Hill,"Wesley Snipes, Ving Rhames, Peter Falk, Michael Rooker",15.0,51.0,25.0,2002.0,8.0,91.0
Armored,2009-12-04,20000000.0,15988876.0,23661038.0,PG-13,88,"Action, Crime, Thriller",Nimród Antal,"Matt Dillon, Jean Reno, Laurence Fishburne, Amaury Nolasco",65.0,143.0,16.0,2009.0,12.0,224.0
Secret in Their Eyes,2015-11-20,20000000.0,20180155.0,30808558.0,PG-13,111,"Crime, Drama, Mystery",Billy Ray,"Chiwetel Ejiofor, Nicole Kidman, Julia Roberts, Dean Norris",25.0,92.0,45.0,2015.0,11.0,162.0
Ghost Ship,2002-10-25,20000000.0,30113491.0,68349884.0,R,91,Horror,Steve Beck,"Gabriel Byrne, Julianna Margulies, Ron Eldard, Desmond Harrington",39.0,112.0,41.0,2002.0,10.0,192.0
Orphan,2009-07-24,20000000.0,41596251.0,78337373.0,R,123,"Horror, Mystery, Thriller",Jaume Collet-Serra,"Vera Farmiga, Peter Sarsgaard, Isabelle Fuhrman, CCH Pounder",62.0,266.0,22.0,2009.0,7.0,350.0
Eye for an Eye,1996-01-12,20000000.0,26792700.0,26792700.0,R,101,"Crime, Drama, Thriller",John Schlesinger,"Sally Field, Ed Harris, Olivia Burnette, Alexandra Kyle",2.0,16.0,10.0,1996.0,1.0,28.0
Home for the Holidays,1995-11-03,20000000.0,17468887.0,22119269.0,PG-13,103,"Comedy, Drama, Romance",Jodie Foster,"Holly Hunter, Robert Downey Jr., Anne Bancroft, Charles Durning",2.0,5.0,10.0,1995.0,11.0,17.0
The Grudge 2,2006-10-13,20000000.0,39143839.0,70743839.0,PG-13,102,"Horror, Thriller",Takashi Shimizu,"Sarah Michelle Gellar, Amber Tamblyn, Arielle Kebbel, Takako Fuji",13.0,69.0,16.0,2006.0,10.0,98.0
Premonition,2007-03-16,20000000.0,47852604.0,81461343.0,PG-13,96,"Drama, Mystery, Thriller",Mennan Yapo,"Sandra Bullock, Julian McMahon, Shyann McClure, Courtney Taylor Burness",18.0,107.0,25.0,2007.0,3.0,150.0
Survivor,2015-05-29,20000000.0,0.0,774905.0,PG-13,96,"Action, Crime, Thriller",James McTeigue,"Parker Sawyers, Dylan McDermott, Bashar Rahal, Royce Pierreson",36.0,152.0,57.0,2015.0,5.0,245.0
Beverly Hills Cop II,1987-05-20,20000000.0,153665036.0,276665036.0,R,100,"Action, Comedy, Crime",Tony Scott,"Eddie Murphy, Judge Reinhold, Jürgen Prochnow, Ronny Cox",15.0,17.0,18.0,1987.0,5.0,50.0
Monte Carlo,2011-07-01,20000000.0,23186769.0,39686769.0,PG,109,"Adventure, Comedy, Family",Thomas Bezucha,"Selena Gomez, Katie Cassidy, Leighton Meester, Cory Monteith",40.0,164.0,24.0,2011.0,7.0,228.0
Holes,2003-04-18,20000000.0,67383924.0,71232214.0,PG,117,"Adventure, Comedy, Drama",Andrew Davis,"Sigourney Weaver, Jon Voight, Tim Blake Nelson, Shia LaBeouf",7.0,17.0,15.0,2003.0,4.0,39.0
School of Rock,2003-10-03,20000000.0,81261177.0,131945303.0,PG-13,108,"Comedy, Music",Richard Linklater,"Jack Black, Adam Pascal, Lucas Papaelias, Chris Stack",23.0,66.0,21.0,2003.0,10.0,110.0
Conan the Barbarian,1982-05-14,20000000.0,38264085.0,79114085.0,R,129,"Adventure, Fantasy",John Milius,"Arnold Schwarzenegger, James Earl Jones, Max von Sydow, Sandahl Bergman",46.0,109.0,31.0,1982.0,5.0,186.0
Machete Kills,2013-10-11,20000000.0,8008161.0,18273009.0,R,107,"Action, Comedy, Crime",Robert Rodriguez,"Danny Trejo, Mel Gibson, Demián Bichir, Amber Heard",62.0,220.0,21.0,2013.0,10.0,303.0
My Best Friends Girl,2008-09-19,20000000.0,19219250.0,34787111.0,R,101,"Comedy, Romance",Howard Deutch,"Dane Cook, Kate Hudson, Alec Baldwin, Jason Biggs",42.0,38.0,28.0,2008.0,9.0,108.0
Envy,2004-04-30,20000000.0,13548322.0,14566246.0,PG-13,99,Comedy,Barry Levinson,"Ben Stiller, Jack Black, Rachel Weisz, Amy Poehler",5.0,28.0,15.0,2004.0,4.0,48.0
Burnt,2015-10-30,20000000.0,13651946.0,32632668.0,R,101,"Comedy, Drama",John Wells,"Bradley Cooper, Sienna Miller, Daniel Brühl, Riccardo Scamarcio",23.0,131.0,55.0,2015.0,10.0,209.0
Stick It,2006-04-28,20000000.0,26910736.0,30399714.0,PG-13,103,"Comedy, Drama, Sport",Jessica Bendinger,"Jeff Bridges, Missy Peregrym, Vanessa Lengies, Nikki SooHoo",6.0,34.0,10.0,2006.0,4.0,50.0
Waynes World,1992-02-14,20000000.0,121697323.0,183097323.0,PG-13,94,"Comedy, Music",Penelope Spheeris,"Mike Myers, Dana Carvey, Rob Lowe, Tia Carrere",12.0,15.0,10.0,1992.0,2.0,37.0
Battle of the Year,2013-09-20,20000000.0,8888355.0,16723377.0,PG-13,110,"Drama, Music",Benson Lee,"Josh Holloway, Laz Alonso, Josh Peck, Caity Lotz",20.0,99.0,16.0,2013.0,9.0,135.0
The Jungle Book 2,2003-02-14,20000000.0,47901582.0,140122225.0,G,72,"Adventure, Animation, Family",Steve Trenbirth,"John Goodman, Haley Joel Osment, Mae Whitman, Connor Funk",19.0,48.0,13.0,2003.0,2.0,80.0
Little Boy,2015-04-24,20000000.0,6485961.0,7965983.0,PG-13,106,"Drama, War",Alejandro Monteverde,"Ted Levine, Kevin James, Abraham Benrubi, Emily Watson",26.0,90.0,42.0,2015.0,4.0,158.0
A Very Harold & Kumar IIID Christmas,2011-11-04,20000000.0,35061031.0,36265745.0,R,90,"Adventure, Comedy",Todd Strauss-Schulson,"Patton Oswalt, Isabella Gielniak, Kal Penn, Austin Bickel",94.0,202.0,38.0,2011.0,11.0,334.0
Raiders of the Lost Ark,1981-06-12,20000000.0,248159971.0,389925971.0,PG,115,"Action, Adventure",Steven Spielberg,"Harrison Ford, Karen Allen, Paul Freeman, Ronald Lacey",71.0,118.0,34.0,1981.0,6.0,223.0
Equilibrium,2002-12-06,20000000.0,1190018.0,5345869.0,R,107,"Action, Drama, Sci-Fi",Kurt Wimmer,"Christian Bale, Dominic Purcell, Sean Bean, Christian Kahrmann",58.0,187.0,53.0,2002.0,12.0,298.0
Strange Wilderness,2008-02-01,20000000.0,6575282.0,6947084.0,R,87,"Adventure, Comedy",Fred Wolf,"Steve Zahn, Allen Covert, Jonah Hill, Kevin Heffernan",18.0,119.0,14.0,2008.0,2.0,151.0
Quigley Down Under,1990-10-19,20000000.0,21413105.0,21413105.0,PG-13,119,"Action, Adventure, Drama",Simon Wincer,"Tom Selleck, Laura San Giacomo, Alan Rickman, Chris Haywood",5.0,22.0,10.0,1990.0,10.0,37.0
The Weather Man,2005-10-28,20000000.0,12482775.0,15466961.0,R,102,"Comedy, Drama",Gore Verbinski,"Nicolas Cage, Michael Caine, Hope Davis, Gemmenne de la Peña",11.0,26.0,11.0,2005.0,10.0,48.0
Ladyhawke,1985-04-12,20000000.0,18400000.0,18400000.0,PG-13,121,"Adventure, Comedy, Drama",Richard Donner,"Matthew Broderick, Rutger Hauer, Michelle Pfeiffer, Leo McKern",17.0,53.0,12.0,1985.0,4.0,82.0
The Worlds End,2013-08-23,20000000.0,26004851.0,47508505.0,R,109,"Action, Comedy, Sci-Fi",Edgar Wright,"Thomas Law, Zachary Bailess, Jasper Levine, James Tarpey",50.0,70.0,25.0,2013.0,8.0,145.0
The Last Song,2010-03-31,20000000.0,62950384.0,92678948.0,PG,107,"Drama, Family, Music",Julie Anne Robinson,"Miley Cyrus, Greg Kinnear, Bobby Coleman, Liam Hemsworth",35.0,131.0,36.0,2010.0,3.0,202.0
The Covenant,2006-09-08,20000000.0,23364784.0,38164784.0,PG-13,97,"Action, Fantasy, Horror",Renny Harlin,"Steven Strait, Laura Ramsey, Sebastian Stan, Taylor Kitsch",32.0,112.0,21.0,2006.0,9.0,165.0
Nancy Drew,2007-06-15,20000000.0,25584685.0,30703845.0,PG,99,"Comedy, Crime, Family",Andrew Fleming,"Emma Roberts, Craig Gellis, Rich Cooper, Max Thieriot",7.0,68.0,10.0,2007.0,6.0,85.0
Shes Out of My League,2010-03-12,20000000.0,32010860.0,48680977.0,R,104,"Comedy, Romance",Jim Field Smith,"Jay Baruchel, Alice Eve, T.J. Miller, Mike Vogel",78.0,44.0,16.0,2010.0,3.0,138.0
Stay Alive,2006-03-24,20000000.0,23086480.0,23187506.0,PG-13,85,"Horror, Thriller",William Brent Bell,"Jon Foster, Samaire Armstrong, Frankie Muniz, Jimmi Simpson",12.0,44.0,15.0,2006.0,3.0,71.0
One Missed Call,2008-01-04,20000000.0,26890041.0,44513466.0,PG-13,87,"Horror, Mystery",Eric Valette,"Shannyn Sossamon, Edward Burns, Ana Claudia Talancón, Ray Wise",26.0,140.0,16.0,2008.0,1.0,182.0
Jaws 2,1978-06-16,20000000.0,102922376.0,208900376.0,PG,116,"Adventure, Horror, Thriller",Jeannot Szwarc,"Roy Scheider, Lorraine Gary, Murray Hamilton, Joseph Mascolo",7.0,40.0,26.0,1978.0,6.0,73.0
Alone in the Dark,2005-01-28,20000000.0,5178569.0,8178569.0,R,96,"Horror, Sci-Fi",Uwe Boll,"Christian Slater, Tara Reid, Stephen Dorff, Frank C. Turner",12.0,53.0,13.0,2005.0,1.0,78.0
The Conjuring,2013-07-19,20000000.0,137400141.0,318000141.0,R,112,"Horror, Mystery, Thriller",James Wan,"Vera Farmiga, Patrick Wilson, Lili Taylor, Ron Livingston",94.0,362.0,33.0,2013.0,7.0,489.0
From Dusk Till Dawn,1996-01-19,20000000.0,25728961.0,25728961.0,R,108,"Crime, Fantasy, Horror",Robert Rodriguez,"George Clooney, Quentin Tarantino, Harvey Keitel, Juliette Lewis",43.0,144.0,41.0,1996.0,1.0,228.0
Shorts,2009-08-21,20000000.0,20919166.0,29870801.0,PG,89,"Comedy, Family, Fantasy",Robert Rodriguez,"Jimmy Bennett, Jake Short, Kat Dennings, Trevor Gagnon",13.0,95.0,17.0,2009.0,8.0,125.0
The Cold Light of Day,2012-09-07,20000000.0,3763583.0,25361206.0,PG-13,93,"Action, Thriller",Mabrouk El Mechri,"Henry Cavill, Verónica Echegui, Bruce Willis, Sigourney Weaver",58.0,136.0,15.0,2012.0,9.0,209.0
Eternal Sunshine of the Spotless Mind,2004-03-19,20000000.0,34366518.0,73135439.0,R,108,"Drama, Romance, Sci-Fi",Michel Gondry,"Jim Carrey, Kate Winslet, Gerry Robert Byrne, Elijah Wood",47.0,110.0,24.0,2004.0,3.0,181.0
Mortal Kombat,1995-08-18,20000000.0,70433227.0,122133227.0,PG-13,101,"Action, Adventure, Fantasy",Paul W.S. Anderson,"Christopher Lambert, Robin Shou, Linden Ashby, Cary-Hiroyuki Tagawa",30.0,103.0,31.0,1995.0,8.0,164.0
Disturbia,2007-04-13,20000000.0,80818974.0,118537627.0,PG-13,105,"Drama, Mystery, Thriller",D.J. Caruso,"Shia LaBeouf, Sarah Roemer, Carrie-Anne Moss, David Morse",51.0,167.0,26.0,2007.0,4.0,244.0
Were No Angels,1989-12-15,20000000.0,10555348.0,10555348.0,PG-13,106,"Comedy, Crime",Neil Jordan,"Robert De Niro, Sean Penn, Demi Moore, Hoyt Axton",11.0,8.0,10.0,1989.0,12.0,29.0
High Fidelity,2000-03-31,20000000.0,27277055.0,47881663.0,R,113,"Comedy, Drama, Music",Stephen Frears,"John Cusack, Iben Hjejle, Todd Louiso, Jack Black",21.0,47.0,20.0,2000.0,3.0,88.0
Lockout,2012-04-13,20000000.0,14326865.0,33943049.0,PG-13,95,"Action, Adventure, Sci-Fi","James Mather, Stephen St. Leger","Guy Pearce, Maggie Grace, Vincent Regan, Joseph Gilgun",91.0,193.0,10.0,2012.0,4.0,294.0
The Crazies,2010-02-26,19000000.0,39123589.0,56445534.0,R,101,"Horror, Thriller",Breck Eisner,"Timothy Olyphant, Radha Mitchell, Joe Anderson, Danielle Panabaker",96.0,189.0,19.0,2010.0,2.0,304.0
A Cinderella Story,2004-07-16,19000000.0,51438175.0,70164105.0,PG,95,"Comedy, Family, Romance",Mark Rosman,"Hilary Duff, Jennifer Coolidge, Chad Michael Murray, Dan Byrd",10.0,22.0,16.0,2004.0,7.0,48.0
Gone Baby Gone,2007-10-19,19000000.0,20300218.0,34352162.0,R,114,"Crime, Drama, Mystery",Ben Affleck,"Casey Affleck, Michelle Monaghan, Morgan Freeman, Ed Harris",42.0,119.0,22.0,2007.0,10.0,183.0
Take Me Home Tonight,2011-03-04,19000000.0,6928068.0,7576604.0,R,97,"Comedy, Drama, Romance",Michael Dowse,"Topher Grace, Anna Faris, Dan Fogler, Teresa Palmer",48.0,146.0,17.0,2011.0,3.0,211.0
Scary Movie,2000-07-07,19000000.0,157019771.0,277200000.0,R,88,Comedy,Keenen Ivory Wayans,"Carmen Electra, Dave Sheridan, Frank B. Moore, Giacomo Baessato",23.0,87.0,21.0,2000.0,7.0,131.0
Sex Drive,2008-10-17,19000000.0,8402485.0,10412485.0,R,109,"Adventure, Comedy, Romance",Sean Anders,"Josh Zuckerman, Amanda Crew, Clark Duke, James Marsden",50.0,140.0,31.0,2008.0,10.0,221.0
Notorious,2009-01-16,19000000.0,36843682.0,45005151.0,R,122,"Biography, Drama, Music",George Tillman Jr.,"Jamal Woolard, Momo Dione, Derek Luke, Dennis L.A. White",46.0,292.0,22.0,2009.0,1.0,360.0
House on Haunted Hill,1999-10-29,19000000.0,40846082.0,65090541.0,R,93,"Horror, Mystery, Thriller",William Malone,"Geoffrey Rush, Famke Janssen, Taye Diggs, Peter Gallagher",13.0,37.0,20.0,1999.0,10.0,70.0
The Shining,1980-05-23,19000000.0,44017374.0,44414369.0,R,146,"Drama, Horror",Stanley Kubrick,"Jack Nicholson, Shelley Duvall, Danny Lloyd, Scatman Crothers",63.0,171.0,45.0,1980.0,5.0,279.0
Leap Year,2010-01-08,19000000.0,25918920.0,32618920.0,PG,100,"Comedy, Romance",Anand Tucker,"Amy Adams, Matthew Goode, Adam Scott, John Lithgow",54.0,118.0,32.0,2010.0,1.0,204.0
The Switch,2010-08-20,19000000.0,27758465.0,49858465.0,PG-13,101,"Comedy, Drama, Romance","Josh Gordon, Will Speck","Jason Bateman, Victor Pagan, Jennifer Aniston, Jeff Goldblum",72.0,147.0,14.0,2010.0,8.0,233.0
Sea of Love,1989-09-15,19000000.0,58571513.0,58571513.0,R,113,"Crime, Drama, Mystery",Harold Becker,"Al Pacino, Ellen Barkin, John Goodman, Michael Rooker",13.0,29.0,22.0,1989.0,9.0,64.0
Just Married,2003-01-10,19000000.0,56127162.0,101564935.0,PG-13,95,"Comedy, Romance",Shawn Levy,"Ashton Kutcher, Brittany Murphy, Christian Kane, David Moscow",16.0,40.0,15.0,2003.0,1.0,71.0
Back to the Future,1985-07-03,19000000.0,212259762.0,385524862.0,PG,116,"Adventure, Comedy, Sci-Fi",Robert Zemeckis,"Michael J. Fox, Christopher Lloyd, Lea Thompson, Crispin Glover",92.0,176.0,65.0,1985.0,7.0,333.0
Bad Teacher,2011-06-24,19000000.0,100292856.0,215448997.0,R,92,Comedy,Jake Kasdan,"Cameron Diaz, Lucy Punch, Jason Segel, Justin Timberlake",126.0,270.0,32.0,2011.0,6.0,428.0
Fear & Loathing in Las Vegas,1998-05-22,18500000.0,10680275.0,13711903.0,R,118,Comedy,Terry Gilliam,"Johnny Depp, Benicio Del Toro, Tobey Maguire, Ellen Barkin",50.0,139.0,30.0,1998.0,5.0,219.0
The Invention of Lying,2009-10-02,18500000.0,18451251.0,32679264.0,PG-13,100,"Comedy, Fantasy, Romance","Ricky Gervais, Matthew Robinson","Ricky Gervais, Jennifer Garner, Jonah Hill, Louis C.K.",1.0,126.0,17.0,2009.0,10.0,144.0
Day of the Dead,2008-04-08,18000000.0,0.0,0.0,R,86,"Action, Horror",Steve Miner,"Mena Suvari, Nick Cannon, Michael Welch, AnnaLynne McCord",16.0,131.0,22.0,2008.0,4.0,169.0
The Family Stone,2005-12-16,18000000.0,60062868.0,92357499.0,PG-13,103,"Comedy, Drama, Romance",Thomas Bezucha,"Claire Danes, Diane Keaton, Rachel McAdams, Dermot Mulroney",7.0,27.0,13.0,2005.0,12.0,47.0
Under the Tuscan Sun,2003-09-26,18000000.0,43601508.0,57490024.0,PG-13,113,"Comedy, Drama, Romance",Audrey Wells,"Diane Lane, Sandra Oh, Lindsay Duncan, Raoul Bova",12.0,32.0,20.0,2003.0,9.0,64.0
Conan the Destroyer,1984-06-29,18000000.0,26400000.0,26400000.0,PG,103,"Action, Adventure, Fantasy",Richard Fleischer,"Arnold Schwarzenegger, Grace Jones, Wilt Chamberlain, Mako",26.0,77.0,23.0,1984.0,6.0,126.0
United 93,2006-04-28,18000000.0,31567134.0,77635035.0,R,111,"Drama, History, Thriller",Paul Greengrass,"J.J. Johnson, Gary Commock, Polly Adams, Opal Alladin",29.0,59.0,13.0,2006.0,4.0,101.0
Catch-22,1970-06-24,18000000.0,24911670.0,24911670.0,R,122,"Comedy, Drama, War",Mike Nichols,"Alan Arkin, Martin Balsam, Richard Benjamin, Art Garfunkel",14.0,21.0,11.0,1970.0,6.0,46.0
Love the Coopers,2015-11-13,18000000.0,26302731.0,42167286.0,PG-13,107,Comedy,Jessie Nelson,"Steve Martin, Diane Keaton, John Goodman, Ed Helms",11.0,55.0,25.0,2015.0,11.0,91.0
Bad Santa,2003-11-26,18000000.0,60060328.0,77147031.0,R,91,"Comedy, Crime, Drama",Terry Zwigoff,"Billy Bob Thornton, Tony Cox, Brett Kelly, Lauren Graham",36.0,107.0,31.0,2003.0,11.0,174.0
Mean Girls,2004-04-30,18000000.0,86047227.0,130953026.0,PG-13,97,Comedy,Mark Waters,"Lindsay Lohan, Rachel McAdams, Tina Fey, Tim Meadows",26.0,60.0,19.0,2004.0,4.0,105.0
Borat,2006-11-03,18000000.0,128505958.0,261443242.0,R,84,Comedy,Larry Charles,"Sacha Baron Cohen, Ken Davitian, Luenell, Chester",45.0,214.0,14.0,2006.0,11.0,273.0
I Love You Beth Cooper,2009-07-10,18000000.0,14800725.0,16382538.0,PG-13,102,"Comedy, Romance",Chris Columbus,"Hayden Panettiere, Paul Rust, Jack Carpenter, Lauren London",26.0,108.0,13.0,2009.0,7.0,147.0
Jobs,2013-08-16,18000000.0,16131410.0,26131410.0,PG-13,128,"Biography, Drama",Joshua Michael Stern,"Ashton Kutcher, Dermot Mulroney, Josh Gad, Lukas Haas",54.0,279.0,15.0,2013.0,8.0,348.0
Love Happens,2009-09-18,18000000.0,22965110.0,36133014.0,PG-13,109,"Drama, Romance",Brandon Camp,"Aaron Eckhart, Jennifer Aniston, Dan Fogler, John Carroll Lynch",34.0,117.0,16.0,2009.0,9.0,167.0
Honey,2003-12-05,18000000.0,30272254.0,62646763.0,PG-13,94,"Drama, Music, Romance",Bille Woodruff,"Jessica Alba, Mekhi Phifer, Romeo Miller, Joy Bryant",13.0,58.0,20.0,2003.0,12.0,91.0
Prom Night,2008-04-11,18000000.0,43869350.0,57193655.0,PG-13,88,"Horror, Mystery",Nelson McCormick,"Brittany Snow, Scott Porter, Jessica Stroup, Dana Davis",24.0,208.0,12.0,2008.0,4.0,244.0
The Prince,2014-08-22,18000000.0,0.0,0.0,R,93,"Action, Thriller",Brian A Miller,"Jason Patric, Jessica Lowndes, Gia Mantegna, Bruce Willis",49.0,312.0,20.0,2014.0,8.0,381.0
Spy Hard,1996-05-24,18000000.0,26936265.0,26936265.0,PG-13,81,"Comedy, Action",Rick Friedberg,"Leslie Nielsen, Nicollette Sheridan, Charles Durning, Marcia Gay Harden",7.0,21.0,12.0,1996.0,5.0,40.0
Fame,2009-09-25,18000000.0,22455510.0,80227619.0,PG,107,"Comedy, Drama, Musical",Kevin Tancharoen,"Kay Panabaker, Walter Perez, Naturi Naughton, Asher Monroe",23.0,382.0,23.0,2009.0,9.0,428.0
Neighbors,2014-05-09,18000000.0,150086800.0,270594534.0,R,97,Comedy,Nicholas Stoller,"Seth Rogen, Rose Byrne, Elise Vargas, Zoey Vargas",126.0,285.0,21.0,2014.0,5.0,432.0
Getaway,2013-08-30,18000000.0,10501938.0,11813989.0,PG-13,90,"Action, Crime, Thriller",Courtney Solomon,"Ethan Hawke, Selena Gomez, Jon Voight, Rebecca Budig",28.0,314.0,21.0,2013.0,8.0,363.0
Soul Surfer,2011-04-08,18000000.0,43853424.0,47158652.0,PG,106,"Biography, Drama, Family",Sean McNamara,"AnnaSophia Robb, Helen Hunt, Dennis Quaid, Carrie Underwood",54.0,161.0,17.0,2011.0,4.0,232.0
Observe & Report,2009-04-10,18000000.0,24007324.0,27148898.0,R,86,"Comedy, Crime, Drama",Jody Hill,"Seth Rogen, Ray Liotta, Michael Peña, Anna Faris",35.0,137.0,17.0,2009.0,4.0,189.0
Predator,1987-06-12,18000000.0,59735548.0,98267558.0,R,107,"Action, Adventure, Sci-Fi",John McTiernan,"Arnold Schwarzenegger, Carl Weathers, Elpidia Carrillo, Bill Duke",76.0,228.0,68.0,1987.0,6.0,372.0
My Big Fat Greek Wedding 2,2016-03-25,18000000.0,59689605.0,91645122.0,PG-13,94,"Comedy, Family, Romance",Kirk Jones,"Nia Vardalos, John Corbett, Michael Constantine, Lainie Kazan",24.0,127.0,139.0,2016.0,3.0,290.0
Blow Out,1981-07-24,18000000.0,13747234.0,13747234.0,R,107,"Mystery, Thriller",Brian De Palma,"John Travolta, Nancy Allen, John Lithgow, Dennis Franz",16.0,42.0,20.0,1981.0,7.0,78.0
Phantom,2013-03-01,18000000.0,1034589.0,1199510.0,R,98,"Action, Drama, History",Todd Robinson,"Ed Harris, David Duchovny, William Fichtner, Lance Henriksen",67.0,284.0,20.0,2013.0,3.0,371.0
I Am Wrath,2016-04-15,18000000.0,0.0,0.0,R,92,"Action, Crime, Drama",Chuck Russell,"John Travolta, Christopher Meloni, Amanda Schull, Sam Trammell",16.0,80.0,79.0,2016.0,4.0,175.0
The Legend of the Lone Ranger,1981-05-22,18000000.0,13400000.0,13400000.0,PG,98,"Action, Adventure, Western",William A. Fraker,"Klinton Spilsbury, Michael Horse, Christopher Lloyd, Matt Clark",5.0,22.0,12.0,1981.0,5.0,39.0
Beerfest,2006-08-25,17500000.0,19185184.0,20159316.0,R,110,Comedy,Jay Chandrasekhar,"M.C. Gainey, Paul Soter, Erik Stolhanske, Cloris Leachman",16.0,67.0,10.0,2006.0,8.0,93.0
Superbad,2007-08-17,17500000.0,121463226.0,169955142.0,R,113,Comedy,Greg Mottola,"Jonah Hill, Michael Cera, Christopher Mintz-Plasse, Bill Hader",58.0,192.0,14.0,2007.0,8.0,264.0
Friday the 13th,2009-02-13,17000000.0,65002019.0,92670237.0,R,97,Horror,Marcus Nispel,"Jared Padalecki, Danielle Panabaker, Amanda Righetti, Travis Van Winkle",71.0,373.0,31.0,2009.0,2.0,475.0
The Others,2001-08-10,17000000.0,96522687.0,207765056.0,PG-13,104,"Fantasy, Horror, Thriller",Alejandro Amenábar,"Nicole Kidman, Fionnula Flanagan, Christopher Eccleston, Alakina Mann",31.0,84.0,33.0,2001.0,8.0,148.0
Saw IIID,2010-10-29,17000000.0,45710178.0,133735284.0,R,90,"Horror, Mystery",Kevin Greutert,"Tobin Bell, Costas Mandylor, Betsy Russell, Cary Elwes",118.0,61.0,14.0,2010.0,10.0,193.0
40 Days & 40 Nights,2002-03-01,17000000.0,37939782.0,95092667.0,R,96,"Comedy, Romance",Michael Lehmann,"Josh Hartnett, Shannyn Sossamon, Paulo Costanzo, Adam Trese",17.0,35.0,19.0,2002.0,3.0,71.0
Evil Dead,2013-04-05,17000000.0,54239856.0,97778356.0,R,91,"Fantasy, Horror",Fede Alvarez,"Jane Levy, Shiloh Fernandez, Lou Taylor Pucci, Jessica Lucas",98.0,282.0,41.0,2013.0,4.0,421.0
My Life in Ruins,2009-06-05,17000000.0,8665206.0,20465206.0,PG-13,95,"Comedy, Romance",Donald Petrie,"Nia Vardalos, Richard Dreyfuss, Alexis Georgoulis, Alistair McGowan",18.0,107.0,15.0,2009.0,6.0,140.0
Aliens,1986-07-18,17000000.0,85160248.0,183316455.0,R,137,"Action, Adventure, Sci-Fi",James Cameron,"Sigourney Weaver, Carrie Henn, Michael Biehn, Paul Reiser",67.0,163.0,28.0,1986.0,7.0,258.0
Beastly,2011-03-04,17000000.0,27865571.0,38028230.0,PG-13,86,"Drama, Fantasy, Romance",Daniel Barnz,"Alex Pettyfer, Justin Bradley, Mary-Kate Olsen, Dakota Johnson",55.0,151.0,17.0,2011.0,3.0,223.0
Good Boy,2003-10-10,17000000.0,37667746.0,45312217.0,PG,87,"Comedy, Drama, Family",John Hoffman,"Molly Shannon, Liam Aiken, Kevin Nealon, Brittany Moldowan",4.0,11.0,16.0,2003.0,10.0,31.0
I Know What You Did Last Summer,1997-10-17,17000000.0,72250091.0,125250091.0,R,101,"Horror, Mystery, Thriller",Jim Gillespie,"Jennifer Love Hewitt, Sarah Michelle Gellar, Ryan Phillippe, Freddie Prinze Jr.",26.0,57.0,14.0,1997.0,10.0,97.0
McFarland USA,2015-02-20,17000000.0,44480275.0,45707924.0,PG,129,"Biography, Drama, Sport",Niki Caro,"Kevin Costner, Ramiro Rodriguez, Carlos Pratts, Johnny Ortiz",23.0,63.0,42.0,2015.0,2.0,128.0
Running Scared,2006-02-24,17000000.0,6855137.0,9729088.0,R,122,"Action, Crime, Drama",Wayne Kramer,"Paul Walker, Cameron Bright, Vera Farmiga, Chazz Palminteri",39.0,115.0,30.0,2006.0,2.0,184.0
The Apparition,2012-08-24,17000000.0,4936819.0,10637281.0,PG-13,82,"Horror, Thriller",Todd Lincoln,"Ashley Greene, Sebastian Stan, Tom Felton, Julianna Guill",43.0,150.0,19.0,2012.0,8.0,212.0
The Young Messiah,2016-03-11,16800000.0,6469813.0,7155967.0,PG-13,111,Drama,Cyrus Nowrasteh,"Adam Greaves-Neal, Sara Lazzaro, Vincent Walsh, Finn Ireland",8.0,56.0,54.0,2016.0,3.0,118.0
Wall Street,1987-12-11,16500000.0,43848100.0,43848100.0,R,126,"Crime, Drama",Oliver Stone,"Charlie Sheen, Tamara Tunie, Franklin Cover, Chuck Pfeiffer",34.0,90.0,36.0,1987.0,12.0,160.0
My Girl,1991-11-27,16500000.0,58011485.0,58011485.0,PG-13,102,"Comedy, Drama, Family",Howard Zieff,"Dan Aykroyd, Jamie Lee Curtis, Macaulay Culkin, Anna Chlumsky",6.0,34.0,13.0,1991.0,11.0,53.0
The Unborn,2009-01-09,16000000.0,42670410.0,78208812.0,PG-13,88,"Drama, Horror, Mystery",David S. Goyer,"Odette Annable, Gary Oldman, Cam Gigandet, Meagan Good",50.0,269.0,18.0,2009.0,1.0,337.0
