Title,Released,Prod_Budget,Dom_Gross,World_Gross,Rated,Runtime,Genre,Director,Actors,Pirate_Count,Torrentz_Count,Zoogle_Ver_Count,Year,Month,Total_Torrents
Youve Got Mail,1998-12-18,65000000.0,115821495.0,250800000.0,PG,119,"Comedy, Drama, Romance",Nora Ephron,"Tom Hanks, Meg Ryan, Greg Kinnear, Parker Posey",27.0,32.0,25.0,1998.0,12.0,84.0
Jumanji,1995-12-15,65000000.0,100458310.0,262758310.0,PG,104,"Adventure, Family, Fantasy",Joe Johnston,"Robin Williams, Jonathan Hyde, Kirsten Dunst, Bradley Pierce",41.0,108.0,37.0,1995.0,12.0,186.0
This Means War,2012-02-17,65000000.0,54760791.0,156974557.0,PG-13,103,"Action, Comedy, Romance",McG,"Reese Witherspoon, Chris Pine, Tom Hardy, Til Schweiger",97.0,267.0,44.0,2012.0,2.0,408.0
Space Cowboys,2000-08-04,65000000.0,90454043.0,128874043.0,PG-13,130,"Action, Adventure, Thriller",Clint Eastwood,"Clint Eastwood, Tommy Lee Jones, Donald Sutherland, James Garner",15.0,57.0,14.0,2000.0,8.0,86.0
Focus,2015-02-27,65000000.0,53862963.0,154362963.0,R,105,"Comedy, Crime, Drama","Glenn Ficarra, John Requa","Will Smith, Margot Robbie, Adrian Martinez, Gerald McRaney",54.0,344.0,139.0,2015.0,2.0,537.0
Mona Lisa Smile,2003-12-19,65000000.0,63803100.0,141205169.0,PG-13,117,Drama,Mike Newell,"Julia Roberts, Kirsten Dunst, Julia Stiles, Maggie Gyllenhaal",16.0,39.0,19.0,2003.0,12.0,74.0
Fight Club,1999-10-15,65000000.0,37030102.0,100853753.0,R,139,Drama,David Fincher,"Edward Norton, Brad Pitt, Meat Loaf, Zach Grenier",100.0,298.0,76.0,1999.0,10.0,474.0
Annie,2014-12-19,65000000.0,85911262.0,139840525.0,PG,118,"Comedy, Drama, Family",Will Gluck,"Jamie Foxx, Quvenzhané Wallis, Rose Byrne, Bobby Cannavale",23.0,104.0,28.0,2014.0,12.0,155.0
Due Date,2010-11-05,65000000.0,100539043.0,211739043.0,R,95,"Adventure, Comedy",Todd Phillips,"Robert Downey Jr., Zach Galifianakis, Michelle Monaghan, Jamie Foxx",131.0,203.0,35.0,2010.0,11.0,369.0
Death Race,2008-08-22,65000000.0,36316032.0,72516819.0,R,105,"Action, Sci-Fi, Thriller",Paul W.S. Anderson,"Jason Statham, Joan Allen, Ian McShane, Tyrese Gibson",100.0,442.0,40.0,2008.0,8.0,582.0
What Women Want,2000-12-15,65000000.0,182805123.0,374105123.0,PG-13,127,"Comedy, Fantasy, Romance",Nancy Meyers,"Mel Gibson, Helen Hunt, Marisa Tomei, Alan Alda",15.0,48.0,22.0,2000.0,12.0,85.0
World Trade Center,2006-08-09,65000000.0,70278893.0,163295654.0,PG-13,129,"Drama, History, Thriller",Oliver Stone,"Nicolas Cage, Maria Bello, Connor Paolo, Anthony Piccininni",28.0,108.0,21.0,2006.0,8.0,157.0
Total Recall,1990-06-01,65000000.0,119394839.0,261400000.0,R,113,"Action, Sci-Fi",Paul Verhoeven,"Arnold Schwarzenegger, Rachel Ticotin, Sharon Stone, Ronny Cox",74.0,180.0,50.0,1990.0,6.0,304.0
Broken Arrow,1996-02-09,65000000.0,70645997.0,148345997.0,R,108,"Action, Crime, Thriller",John Woo,"John Travolta, Christian Slater, Samantha Mathis, Delroy Lindo",17.0,83.0,21.0,1996.0,2.0,121.0
Proof of Life,2000-12-08,65000000.0,32598931.0,62761005.0,R,135,"Action, Drama, Thriller",Taylor Hackford,"Meg Ryan, Russell Crowe, David Morse, Pamela Reed",10.0,34.0,13.0,2000.0,12.0,57.0
The Long Kiss Goodnight,1996-10-11,65000000.0,33447612.0,33447612.0,R,121,"Action, Crime, Drama",Renny Harlin,"Geena Davis, Samuel L. Jackson, Yvonne Zima, Craig Bierko",20.0,58.0,27.0,1996.0,10.0,105.0
The Missing,2003-11-26,65000000.0,26900336.0,38253433.0,R,137,"Adventure, Thriller, Western",Ron Howard,"Tommy Lee Jones, Cate Blanchett, Evan Rachel Wood, Jenna Boyd",8.0,41.0,15.0,2003.0,11.0,64.0
Hudson Hawk,1991-05-24,65000000.0,17218916.0,17218916.0,R,100,"Action, Adventure, Comedy",Michael Lehmann,"Bruce Willis, Danny Aiello, Andie MacDowell, James Coburn",17.0,55.0,34.0,1991.0,5.0,106.0
Elektra,2005-01-14,65000000.0,24409722.0,56409722.0,PG-13,97,"Action, Crime, Fantasy",Rob Bowman,"Jennifer Garner, Goran Visnjic, Kirsten Prout, Will Yun Lee",32.0,109.0,39.0,2005.0,1.0,180.0
Zathura,2005-11-11,65000000.0,28045540.0,58545540.0,PG,101,"Action, Adventure, Comedy",Jon Favreau,"Jonah Bobo, Josh Hutcherson, Dax Shepard, Kristen Stewart",29.0,83.0,12.0,2005.0,11.0,124.0
Step Brothers,2008-07-25,65000000.0,100468793.0,128468793.0,R,98,Comedy,Adam McKay,"Will Ferrell, John C. Reilly, Mary Steenburgen, Richard Jenkins",54.0,88.0,18.0,2008.0,7.0,160.0
Unbroken,2014-12-25,65000000.0,115637895.0,163442936.0,PG-13,137,"Biography, Drama, Sport",Angelina Jolie,"Jack O'Connell, Domhnall Gleeson, Garrett Hedlund, Miyavi",35.0,172.0,42.0,2014.0,12.0,249.0
Random Hearts,1999-10-08,64000000.0,31054924.0,63200000.0,R,133,"Drama, Mystery, Romance",Sydney Pollack,"Harrison Ford, Kristin Scott Thomas, Charles S. Dutton, Bonnie Hunt",7.0,11.0,10.0,1999.0,10.0,28.0
Jurassic Park,1993-06-11,63000000.0,395708305.0,1038812584.0,PG-13,127,"Adventure, Sci-Fi, Thriller",Steven Spielberg,"Sam Neill, Laura Dern, Jeff Goldblum, Richard Attenborough",86.0,230.0,62.0,1993.0,6.0,378.0
Hop,2011-04-01,63000000.0,108085305.0,188657593.0,PG,95,"Animation, Adventure, Comedy",Tim Hill,"James Marsden, Russell Brand, Kaley Cuoco, Hank Azaria",90.0,957.0,19.0,2011.0,4.0,1066.0
The Love Guru,2008-06-20,62000000.0,32200122.0,40123346.0,PG-13,87,"Comedy, Romance, Sport",Marco Schnabel,"Jessica Simpson, Kanye West, Mike Myers, Deepak Chopra",28.0,101.0,13.0,2008.0,6.0,142.0
Clear & Present Danger,1994-08-03,62000000.0,122012656.0,207500000.0,PG-13,141,"Action, Crime, Drama",Phillip Noyce,"Harrison Ford, Willem Dafoe, Anne Archer, Joaquim de Almeida",22.0,62.0,18.0,1994.0,8.0,102.0
U-571,2000-04-21,62000000.0,77086030.0,127630030.0,PG-13,116,"Action, War",Jonathan Mostow,"Matthew McConaughey, Bill Paxton, Harvey Keitel, Jon Bon Jovi",28.0,108.0,30.0,2000.0,4.0,166.0
Gone Girl,2014-10-03,61000000.0,167767189.0,368567189.0,R,149,"Crime, Drama, Mystery",David Fincher,"Ben Affleck, Rosamund Pike, Neil Patrick Harris, Tyler Perry",18.0,258.0,78.0,2014.0,10.0,354.0
2 Guns,2013-08-02,61000000.0,75612460.0,132493015.0,R,109,"Action, Comedy, Crime",Baltasar Kormákur,"Denzel Washington, Mark Wahlberg, Paula Patton, Edward James Olmos",66.0,296.0,41.0,2013.0,8.0,403.0
Blades of Glory,2007-03-30,61000000.0,118594548.0,145594548.0,PG-13,93,"Comedy, Sport","Josh Gordon, Will Speck","Will Ferrell, Jon Heder, Will Arnett, Amy Poehler",28.0,95.0,16.0,2007.0,3.0,139.0
Ladder 49,2004-10-01,60000000.0,74541707.0,102332848.0,PG-13,115,"Action, Drama, Thriller",Jay Russell,"Joaquin Phoenix, John Travolta, Jacinda Barrett, Robert Patrick",24.0,58.0,12.0,2004.0,10.0,94.0
Duplicity,2009-03-20,60000000.0,40572825.0,81079566.0,PG-13,125,"Crime, Romance, Thriller",Tony Gilroy,"Clive Owen, Julia Roberts, Tom Wilkinson, Paul Giamatti",52.0,269.0,21.0,2009.0,3.0,342.0
The Sentinel,2006-04-21,60000000.0,36280697.0,78080697.0,PG-13,108,"Action, Crime, Thriller",Clark Johnson,"Michael Douglas, Kiefer Sutherland, Eva Longoria, Martin Donovan",22.0,73.0,26.0,2006.0,4.0,121.0
Paycheck,2003-12-25,60000000.0,53789313.0,98819789.0,PG-13,119,"Action, Mystery, Sci-Fi",John Woo,"Ben Affleck, Aaron Eckhart, Uma Thurman, Paul Giamatti",34.0,101.0,32.0,2003.0,12.0,167.0
The Italian Job,2003-05-30,60000000.0,106126012.0,176262839.0,PG-13,111,"Action, Crime, Thriller",F. Gary Gray,"Mark Wahlberg, Charlize Theron, Donald Sutherland, Jason Statham",54.0,169.0,32.0,2003.0,5.0,255.0
Man on Fire,2004-04-23,60000000.0,77906816.0,130968579.0,R,146,"Action, Crime, Drama",Tony Scott,"Denzel Washington, Dakota Fanning, Radha Mitchell, Christopher Walken",52.0,164.0,40.0,2004.0,4.0,256.0
The Soloist,2009-04-24,60000000.0,31720158.0,38389024.0,PG-13,117,"Biography, Drama, Music",Joe Wright,"Jamie Foxx, Robert Downey Jr., Catherine Keener, Tom Hollander",33.0,154.0,16.0,2009.0,4.0,203.0
Eat Pray Love,2010-08-13,60000000.0,80574010.0,206598789.0,PG-13,133,"Drama, Romance",Ryan Murphy,"Julia Roberts, I. Gusti Ayu Puspawati, Hadi Subiyanto, Billy Crudup",65.0,95.0,19.0,2010.0,8.0,179.0
Holy Man,1998-10-09,60000000.0,12069719.0,12069719.0,PG,114,"Comedy, Drama",Stephen Herek,"Eddie Murphy, Jeff Goldblum, Kelly Preston, Robert Loggia",4.0,15.0,14.0,1998.0,10.0,33.0
Shooter,2007-03-23,60000000.0,47003582.0,95538560.0,R,124,"Action, Crime, Drama",Antoine Fuqua,"Mark Wahlberg, Michael Peña, Danny Glover, Kate Mara",76.0,365.0,53.0,2007.0,3.0,494.0
The Last Castle,2001-10-19,60000000.0,18208078.0,20541668.0,R,131,"Action, Drama, Thriller",Rod Lurie,"Robert Redford, James Gandolfini, Mark Ruffalo, Steve Burton",13.0,29.0,20.0,2001.0,10.0,62.0
The Family Man,2000-12-22,60000000.0,75764085.0,124715863.0,PG-13,125,"Comedy, Drama, Fantasy",Brett Ratner,"Nicolas Cage, Téa Leoni, Don Cheadle, Jeremy Piven",12.0,45.0,37.0,2000.0,12.0,94.0
Winters Tale,2014-02-14,60000000.0,12600231.0,22468620.0,PG-13,118,"Drama, Fantasy, Mystery",Akiva Goldsman,"Colin Farrell, Matt Bomer, Lucy Griffiths, Michael Crane",95.0,75.0,20.0,2014.0,2.0,190.0
Wild Hogs,2007-03-02,60000000.0,168213584.0,253555383.0,PG-13,100,"Action, Adventure, Comedy",Walt Becker,"Tim Allen, John Travolta, Martin Lawrence, William H. Macy",32.0,119.0,27.0,2007.0,3.0,178.0
Deep Blue Sea,1999-07-28,60000000.0,73648228.0,165048228.0,R,105,"Action, Sci-Fi, Thriller",Renny Harlin,"Thomas Jane, Saffron Burrows, Samuel L. Jackson, Jacqueline McKenzie",31.0,99.0,30.0,1999.0,7.0,160.0
Couples Retreat,2009-10-09,60000000.0,109205660.0,172450423.0,PG-13,113,Comedy,Peter Billingsley,"Vince Vaughn, Jason Bateman, Faizon Love, Jon Favreau",45.0,145.0,23.0,2009.0,10.0,213.0
Collateral,2004-08-06,60000000.0,100170152.0,217670152.0,R,120,"Crime, Drama, Thriller",Michael Mann,"Tom Cruise, Jamie Foxx, Jada Pinkett Smith, Mark Ruffalo",43.0,133.0,40.0,2004.0,8.0,216.0
The Jackal,1997-11-14,60000000.0,54956941.0,159356941.0,R,124,"Action, Adventure, Crime",Michael Caton-Jones,"Bruce Willis, Richard Gere, Sidney Poitier, Diane Venora",29.0,106.0,27.0,1997.0,11.0,162.0
Trouble with the Curve,2012-09-21,60000000.0,35763137.0,47818913.0,PG-13,111,"Drama, Sport",Robert Lorenz,"Clint Eastwood, Chelcie Ross, Raymond Anthony Thomas, Ed Lauter",52.0,143.0,19.0,2012.0,9.0,214.0
Meet the Fockers,2004-12-22,60000000.0,279167575.0,516567575.0,PG-13,115,"Comedy, Romance",Jay Roach,"Robert De Niro, Ben Stiller, Dustin Hoffman, Barbra Streisand",20.0,51.0,20.0,2004.0,12.0,91.0
Intolerable Cruelty,2003-10-10,60000000.0,35327628.0,121327628.0,PG-13,100,"Comedy, Crime, Romance","Joel Coen, Ethan Coen","George Clooney, Catherine Zeta-Jones, Geoffrey Rush, Cedric the Entertainer",16.0,33.0,22.0,2003.0,10.0,71.0
Daddy Day Care,2003-05-09,60000000.0,104148781.0,164285587.0,PG,92,"Comedy, Family",Steve Carr,"Eddie Murphy, Jeff Garlin, Steve Zahn, Regina King",9.0,20.0,14.0,2003.0,5.0,43.0
The Bourne Identity,2002-06-14,60000000.0,121468960.0,214357371.0,PG-13,119,"Action, Mystery, Thriller",Doug Liman,"Matt Damon, Franka Potente, Chris Cooper, Clive Owen",89.0,125.0,57.0,2002.0,6.0,271.0
Dark Water,2005-07-08,60000000.0,25473093.0,49473093.0,PG-13,105,"Drama, Horror, Thriller",Walter Salles,"Jennifer Connelly, John C. Reilly, Tim Roth, Dougray Scott",13.0,67.0,18.0,2005.0,7.0,98.0
Flyboys,2006-09-22,60000000.0,13090630.0,14816379.0,PG-13,140,"Action, Adventure, Drama",Tony Bill,"James Franco, Scott Hazell, Mac McDonald, Philip Winchester",21.0,81.0,22.0,2006.0,9.0,124.0
Joy,2015-12-25,60000000.0,56451232.0,100751232.0,PG-13,124,"Biography, Comedy, Drama",David O. Russell,"Jennifer Lawrence, Robert De Niro, Bradley Cooper, Edgar Ramírez",37.0,740.0,164.0,2015.0,12.0,941.0
Invictus,2009-12-11,60000000.0,37491364.0,124514011.0,PG-13,134,"Biography, Drama, History",Clint Eastwood,"Morgan Freeman, Matt Damon, Tony Kgoroge, Patrick Mofokeng",59.0,153.0,14.0,2009.0,12.0,226.0
Rules of Engagement,2000-04-07,60000000.0,61322858.0,71719931.0,R,128,"Drama, Thriller, War",William Friedkin,"Tommy Lee Jones, Samuel L. Jackson, Guy Pearce, Ben Kingsley",16.0,33.0,13.0,2000.0,4.0,62.0
The Relic,1997-01-10,60000000.0,33956608.0,33956608.0,R,110,"Horror, Mystery, Sci-Fi",Peter Hyams,"Penelope Ann Miller, Tom Sizemore, Linda Hunt, James Whitmore",11.0,16.0,11.0,1997.0,1.0,38.0
The Spirit,2008-12-25,60000000.0,19806188.0,39006188.0,PG-13,103,"Action, Crime, Fantasy",Frank Miller,"Jaime King, Gabriel Macht, Dan Gerrity, Arthur the Cat",53.0,307.0,25.0,2008.0,12.0,385.0
The Scorpion King,2002-04-19,60000000.0,90580000.0,165890634.0,PG-13,92,"Action, Adventure, Fantasy",Chuck Russell,"Dwayne Johnson, Steven Brand, Michael Clarke Duncan, Kelly Hu",25.0,76.0,18.0,2002.0,4.0,119.0
Beyond Borders,2003-10-24,60000000.0,4426297.0,11427090.0,R,127,"Adventure, Drama, Romance",Martin Campbell,"Angelina Jolie, Clive Owen, Teri Polo, Linus Roache",12.0,32.0,17.0,2003.0,10.0,61.0
State of Play,2009-04-17,60000000.0,37017955.0,88832210.0,PG-13,127,"Crime, Drama, Mystery",Kevin Macdonald,"Russell Crowe, Ben Affleck, Rachel McAdams, Helen Mirren",49.0,219.0,27.0,2009.0,4.0,295.0
Jingle All the Way,1996-11-22,60000000.0,60592389.0,129832389.0,PG,89,"Comedy, Family",Brian Levant,"Arnold Schwarzenegger, Sinbad, Phil Hartman, Rita Wilson",22.0,60.0,20.0,1996.0,11.0,102.0
Mortdecai,2015-01-23,60000000.0,7696134.0,30396134.0,R,107,"Action, Comedy, Mystery",David Koepp,"Johnny Depp, Gwyneth Paltrow, Paul Bettany, Ewan McGregor",24.0,85.0,55.0,2015.0,1.0,164.0
Dragonfly,2002-02-22,60000000.0,30063805.0,30063805.0,PG-13,104,"Drama, Fantasy, Mystery",Tom Shadyac,"Kevin Costner, Susanna Thompson, Joe Morton, Ron Rifkin",6.0,27.0,16.0,2002.0,2.0,49.0
Two Weeks Notice,2002-12-20,60000000.0,93354918.0,199043309.0,PG-13,101,"Comedy, Romance",Marc Lawrence,"Sandra Bullock, Hugh Grant, Alicia Witt, Dana Ivey",15.0,40.0,20.0,2002.0,12.0,75.0
Gangster Squad,2013-01-11,60000000.0,46000903.0,104100903.0,R,113,"Action, Crime, Drama",Ruben Fleischer,"Sean Penn, Holt McCallany, Wade Williams, James Landry Hébert",144.0,405.0,25.0,2013.0,1.0,574.0
The Legend of Bagger Vance,2000-11-03,60000000.0,30695227.0,39235486.0,PG-13,126,"Drama, Fantasy, Sport",Robert Redford,"Will Smith, Matt Damon, Charlize Theron, Bruce McGill",6.0,20.0,13.0,2000.0,11.0,39.0
London Has Fallen,2016-03-04,60000000.0,62524260.0,193857962.0,R,99,"Action, Crime, Drama",Babak Najafi,"Alon Aboutboul, Waleed Zuaiter, Adel Bencherif, Mehdi Dehbi",68.0,294.0,267.0,2016.0,3.0,629.0
Starsky & Hutch,2004-03-05,60000000.0,88200225.0,170200225.0,PG-13,101,"Comedy, Crime",Todd Phillips,"Ben Stiller, Owen Wilson, Snoop Dogg, Fred Williamson",31.0,159.0,32.0,2004.0,3.0,222.0
The Truman Show,1998-06-05,60000000.0,125618201.0,264118201.0,PG,103,Drama,Peter Weir,"Jim Carrey, Laura Linney, Noah Emmerich, Natascha McElhone",46.0,108.0,45.0,1998.0,6.0,199.0
The Avengers,1998-08-14,60000000.0,23385416.0,48585416.0,PG-13,89,"Action, Adventure, Sci-Fi",Jeremiah S. Chechik,"Ralph Fiennes, Uma Thurman, Sean Connery, Patrick Macnee",12.0,33.0,11.0,1998.0,8.0,56.0
The Black Dahlia,2006-09-15,60000000.0,22672813.0,49238525.0,R,121,"Crime, Drama, Mystery",Brian De Palma,"Josh Hartnett, Scarlett Johansson, Aaron Eckhart, Hilary Swank",15.0,63.0,24.0,2006.0,9.0,102.0
The Horse Whisperer,1998-05-15,60000000.0,75383563.0,186883563.0,PG-13,170,"Drama, Romance, Western",Robert Redford,"Robert Redford, Kristin Scott Thomas, Sam Neill, Dianne Wiest",15.0,36.0,13.0,1998.0,5.0,64.0
Hellboy,2004-04-02,60000000.0,59623958.0,99823958.0,PG-13,122,"Action, Fantasy, Horror",Guillermo del Toro,"Ron Perlman, John Hurt, Selma Blair, Rupert Evans",53.0,142.0,44.0,2004.0,4.0,239.0
My Favorite Martian,1999-02-12,60000000.0,36850101.0,36850101.0,PG,94,"Comedy, Family, Sci-Fi",Donald Petrie,"Christopher Lloyd, Jeff Daniels, Elizabeth Hurley, Daryl Hannah",3.0,10.0,17.0,1999.0,2.0,30.0
The Lego Movie,2014-02-07,60000000.0,257784718.0,457729388.0,PG,100,"Animation, Action, Adventure","Phil Lord, Christopher Miller","Will Arnett, Elizabeth Banks, Craig Berry, Alison Brie",150.0,472.0,19.0,2014.0,2.0,641.0
Event Horizon,1997-08-15,60000000.0,26673242.0,26673242.0,R,96,"Horror, Sci-Fi, Thriller",Paul W.S. Anderson,"Laurence Fishburne, Sam Neill, Kathleen Quinlan, Joely Richardson",30.0,112.0,31.0,1997.0,8.0,173.0
Priest,2011-05-13,60000000.0,29136626.0,84154026.0,PG-13,87,"Action, Fantasy, Horror",Scott Stewart,"Paul Bettany, Karl Urban, Cam Gigandet, Maggie Q",139.0,320.0,31.0,2011.0,5.0,490.0
Contagion,2011-09-09,60000000.0,75658097.0,137551594.0,PG-13,106,"Drama, Thriller",Steven Soderbergh,"Gwyneth Paltrow, Tien You Chui, Josie Ho, Daria Strokous",104.0,267.0,31.0,2011.0,9.0,402.0
Days of Thunder,1990-06-27,60000000.0,82670733.0,157670733.0,PG-13,107,"Action, Drama, Sport",Tony Scott,"Tom Cruise, Nicole Kidman, Robert Duvall, Randy Quaid",18.0,76.0,22.0,1990.0,6.0,116.0
Mercury Rising,1998-04-03,60000000.0,32983332.0,32983332.0,R,111,"Action, Crime, Drama",Harold Becker,"Bruce Willis, Alec Baldwin, Miko Hughes, Chi McBride",15.0,58.0,21.0,1998.0,4.0,94.0
Practical Magic,1998-10-16,60000000.0,46850558.0,68336997.0,PG-13,104,"Comedy, Drama, Fantasy",Griffin Dunne,"Sandra Bullock, Nicole Kidman, Stockard Channing, Dianne Wiest",7.0,44.0,17.0,1998.0,10.0,68.0
The Ridiculous 6,2015-12-11,60000000.0,0.0,0.0,TV-14,119,"Comedy, Western",Frank Coraci,"Adam Sandler, Terry Crews, Jorge Garcia, Taylor Lautner",17.0,70.0,37.0,2015.0,12.0,124.0
The Green Mile,1999-12-10,60000000.0,136801374.0,290701374.0,R,189,"Crime, Drama, Fantasy",Frank Darabont,"Tom Hanks, David Morse, Michael Clarke Duncan, Bonnie Hunt",64.0,192.0,47.0,1999.0,12.0,303.0
Supernova,2000-01-14,60000000.0,14218868.0,14218868.0,PG-13,90,"Horror, Sci-Fi, Thriller",Walter Hill,"James Spader, Angela Bassett, Robert Forster, Lou Diamond Phillips",9.0,32.0,17.0,2000.0,1.0,58.0
Year One,2009-06-19,60000000.0,43337279.0,57604723.0,PG-13,97,"Adventure, Comedy",Harold Ramis,"Jack Black, Michael Cera, Oliver Platt, David Cross",36.0,109.0,39.0,2009.0,6.0,184.0
Any Given Sunday,1999-12-22,60000000.0,75530832.0,100230832.0,R,162,"Drama, Sport",Oliver Stone,"Al Pacino, Cameron Diaz, Dennis Quaid, James Woods",17.0,62.0,23.0,1999.0,12.0,102.0
Rambo III,1988-05-25,58000000.0,53715611.0,188715611.0,R,102,"Action, Adventure, Thriller",Peter MacDonald,"Sylvester Stallone, Richard Crenna, Marc de Jonge, Kurtwood Smith",22.0,56.0,24.0,1988.0,5.0,102.0
Sabrina,1995-12-15,58000000.0,53458319.0,87100000.0,PG,127,"Comedy, Drama",Sydney Pollack,"Harrison Ford, Julia Ormond, Greg Kinnear, Nancy Marchand",2.0,11.0,14.0,1995.0,12.0,27.0
Goosebumps,2015-10-16,58000000.0,80069458.0,158162788.0,PG,103,"Adventure, Comedy, Family",Rob Letterman,"Jack Black, Dylan Minnette, Odeya Rush, Ryan Lee",38.0,167.0,115.0,2015.0,10.0,320.0
Red Tails,2012-01-20,58000000.0,49876377.0,50365498.0,PG-13,125,"Action, Adventure, Drama",Anthony Hemingway,"Terrence Howard, Cuba Gooding Jr., Nate Parker, David Oyelowo",60.0,165.0,17.0,2012.0,1.0,242.0
The Internship,2013-06-07,58000000.0,44672764.0,93672764.0,PG-13,119,Comedy,Shawn Levy,"Vince Vaughn, Owen Wilson, Rose Byrne, Aasif Mandvi",58.0,250.0,24.0,2013.0,6.0,332.0
Just Like Heaven,2005-09-16,58000000.0,48318130.0,100687083.0,PG-13,95,"Comedy, Fantasy, Romance",Mark Waters,"Reese Witherspoon, Mark Ruffalo, Donal Logue, Dina Spybey-Waters",12.0,31.0,19.0,2005.0,9.0,62.0
Leatherheads,2008-04-04,58000000.0,31373938.0,41348628.0,PG-13,114,"Comedy, Drama, Romance",George Clooney,"John Krasinski, David de Vries, Rick Forrester, Craig S. Harper",23.0,84.0,14.0,2008.0,4.0,121.0
Thats My Boy,2012-06-15,57500000.0,36931089.0,58085235.0,R,116,Comedy,Sean Anders,"Adam Sandler, Andy Samberg, Leighton Meester, Vanilla Ice",55.0,47.0,17.0,2012.0,6.0,119.0
Sex & the City,2008-05-30,57500000.0,152647258.0,415247258.0,R,145,"Comedy, Drama, Romance",Michael Patrick King,"Sarah Jessica Parker, Kim Cattrall, Kristin Davis, Cynthia Nixon",50.0,213.0,26.0,2008.0,5.0,289.0
Captain Corellis Mandolin,2001-08-17,57000000.0,25528495.0,62097495.0,R,131,"Drama, Music, Romance",John Madden,"Penélope Cruz, John Hurt, Christian Bale, Irene Papas",7.0,9.0,10.0,2001.0,8.0,26.0
After the Sunset,2004-11-12,57000000.0,28328132.0,38329114.0,PG-13,97,"Action, Comedy, Crime",Brett Ratner,"Pierce Brosnan, Salma Hayek, Woody Harrelson, Don Cheadle",18.0,70.0,26.0,2004.0,11.0,114.0
The Pacifier,2005-03-04,56000000.0,113006880.0,198006880.0,PG,95,"Action, Comedy, Drama",Adam Shankman,"Vin Diesel, Lauren Graham, Faith Ford, Brittany Snow",31.0,65.0,22.0,2005.0,3.0,118.0
Anger Management,2003-04-11,56000000.0,135560942.0,195660942.0,PG-13,106,Comedy,Peter Segal,"Adam Sandler, Jack Nicholson, Marisa Tomei, Luis Guzmán",33.0,63.0,29.0,2003.0,4.0,125.0
Walking Tall,2004-04-02,56000000.0,46213824.0,47313824.0,PG-13,86,"Action, Crime",Kevin Bray,"Michael Bowen, Johnny Knoxville, Dwayne Johnson, Neal McDonough",22.0,100.0,18.0,2004.0,4.0,140.0
Burlesque,2010-11-24,55000000.0,39440655.0,90552675.0,PG-13,119,"Drama, Music, Romance",Steve Antin,"Cher, Christina Aguilera, Eric Dane, Cam Gigandet",71.0,120.0,18.0,2010.0,11.0,209.0
Executive Decision,1996-03-15,55000000.0,56679192.0,122079192.0,R,133,"Action, Adventure, Thriller",Stuart Baird,"Kurt Russell, Steven Seagal, Halle Berry, John Leguizamo",14.0,48.0,20.0,1996.0,3.0,82.0
Lucky You,2007-05-04,55000000.0,5755286.0,6521829.0,PG-13,124,"Drama, Romance, Sport",Curtis Hanson,"Phyllis Somerville, Eric Bana, Horatio Sanz, Drew Barrymore",9.0,89.0,13.0,2007.0,5.0,111.0
The Nutty Professor,1996-06-28,55000000.0,128814019.0,273814019.0,PG-13,95,"Comedy, Romance, Sci-Fi",Tom Shadyac,"Eddie Murphy, Jada Pinkett Smith, James Coburn, Larry Miller",18.0,31.0,16.0,1996.0,6.0,65.0
The Hunted,2003-03-14,55000000.0,34234008.0,45016494.0,R,94,"Action, Crime, Drama",William Friedkin,"Tommy Lee Jones, Benicio Del Toro, Connie Nielsen, Leslie Stefanson",15.0,52.0,15.0,2003.0,3.0,82.0
Captain Phillips,2013-10-11,55000000.0,107136417.0,220648184.0,PG-13,134,"Biography, Drama, Thriller",Paul Greengrass,"Tom Hanks, Catherine Keener, Barkhad Abdi, Barkhad Abdirahman",118.0,310.0,26.0,2013.0,10.0,454.0
The Phantom of the Opera,2004-12-22,55000000.0,51225796.0,154605868.0,PG-13,143,"Drama, Musical, Romance",Joel Schumacher,"Gerard Butler, Emmy Rossum, Patrick Wilson, Miranda Richardson",21.0,73.0,23.0,2004.0,12.0,117.0
Death Becomes Her,1992-07-31,55000000.0,58422650.0,149022650.0,PG-13,104,"Comedy, Fantasy",Robert Zemeckis,"Meryl Streep, Bruce Willis, Goldie Hawn, Isabella Rossellini",10.0,41.0,23.0,1992.0,7.0,74.0
The Equalizer,2014-09-26,55000000.0,101530738.0,192165283.0,R,132,"Action, Crime, Thriller",Antoine Fuqua,"Denzel Washington, Marton Csokas, Chloë Grace Moretz, David Harbour",28.0,162.0,28.0,2014.0,9.0,218.0
The Pursuit of Happyness,2006-12-15,55000000.0,162586036.0,307325633.0,PG-13,117,"Biography, Drama",Gabriele Muccino,"Will Smith, Jaden Smith, Thandie Newton, Brian Howe",48.0,118.0,19.0,2006.0,12.0,185.0
The Forbidden Kingdom,2008-04-18,55000000.0,52075270.0,129075270.0,PG-13,104,"Action, Adventure, Fantasy",Rob Minkoff,"Jet Li, Michael Angarano, Jackie Chan, Juana Collignon",65.0,221.0,27.0,2008.0,4.0,313.0
Superman,1978-12-15,55000000.0,134218018.0,300200000.0,PG,143,"Action, Adventure, Drama",Richard Donner,"Marlon Brando, Gene Hackman, Christopher Reeve, Ned Beatty",32.0,116.0,20.0,1978.0,12.0,168.0
Hitch,2005-02-11,55000000.0,177784257.0,366784257.0,PG-13,118,"Comedy, Romance",Andy Tennant,"Will Smith, Eva Mendes, Kevin James, Amber Valletta",39.0,203.0,34.0,2005.0,2.0,276.0
Semi-Pro,2008-02-29,55000000.0,33479698.0,43980363.0,R,91,"Comedy, Sport",Kent Alterman,"Will Ferrell, Woody Harrelson, André Benjamin, Maura Tierney",18.0,118.0,14.0,2008.0,2.0,150.0
Alvin & the Chipmunks,2007-12-14,55000000.0,217326974.0,362605033.0,PG,92,"Animation, Comedy, Family",Tim Hill,"Jason Lee, David Cross, Cameron Richardson, Jane Lynch",34.0,152.0,27.0,2007.0,12.0,213.0
Meet the Parents,2000-10-06,55000000.0,166225040.0,304599899.0,PG-13,108,Comedy,Jay Roach,"Robert De Niro, Ben Stiller, Teri Polo, Blythe Danner",25.0,58.0,27.0,2000.0,10.0,110.0
Date Night,2010-04-09,55000000.0,98711404.0,152269033.0,PG-13,88,"Comedy, Crime, Romance",Shawn Levy,"Steve Carell, Tina Fey, Mark Wahlberg, Taraji P. Henson",71.0,143.0,21.0,2010.0,4.0,235.0
Ronin,1998-09-25,55000000.0,41610884.0,70692101.0,R,122,"Action, Adventure, Crime",John Frankenheimer,"Robert De Niro, Jean Reno, Natascha McElhone, Stellan Skarsgård",37.0,133.0,34.0,1998.0,9.0,204.0
Maid in Manhattan,2002-12-13,55000000.0,93932896.0,163838217.0,PG-13,105,"Comedy, Drama, Romance",Wayne Wang,"Jennifer Lopez, Ralph Fiennes, Natasha Richardson, Stanley Tucci",5.0,25.0,18.0,2002.0,12.0,48.0
RV,2006-04-28,55000000.0,71724497.0,87524497.0,PG,99,"Adventure, Comedy, Family",Barry Sonnenfeld,"Robin Williams, Cheryl Hines, Joanna 'JoJo' Levesque, Josh Hutcherson",16.0,40.0,13.0,2006.0,4.0,69.0
Alien III,1992-05-22,55000000.0,54927174.0,158500000.0,R,114,"Action, Horror, Sci-Fi",David Fincher,"Sigourney Weaver, Charles S. Dutton, Charles Dance, Paul McGann",44.0,88.0,36.0,1992.0,5.0,168.0
The Fan,1996-08-16,55000000.0,18582965.0,18582965.0,R,116,"Action, Drama, Sport",Tony Scott,"Robert De Niro, Wesley Snipes, Ellen Barkin, John Leguizamo",5.0,50.0,17.0,1996.0,8.0,72.0
Flightplan,2005-09-23,55000000.0,89706988.0,214392904.0,PG-13,98,"Drama, Mystery, Thriller",Robert Schwentke,"Jodie Foster, Peter Sarsgaard, Sean Bean, Kate Beahan",27.0,92.0,26.0,2005.0,9.0,145.0
Imagine That,2009-06-12,55000000.0,16123323.0,16123323.0,PG,107,"Comedy, Drama, Family",Karey Kirkpatrick,"Eddie Murphy, Thomas Haden Church, Yara Shahidi, Ronny Cox",22.0,165.0,14.0,2009.0,6.0,201.0
Disclosure,1994-12-09,55000000.0,83015089.0,212200000.0,R,128,"Drama, Thriller",Barry Levinson,"Michael Douglas, Demi Moore, Donald Sutherland, Caroline Goodall",13.0,43.0,19.0,1994.0,12.0,75.0
American Wedding,2003-08-01,55000000.0,104354205.0,126425115.0,R,96,Comedy,Jesse Dylan,"Jason Biggs, Seann William Scott, Alyson Hannigan, Eddie Kaye Thomas",22.0,63.0,20.0,2003.0,8.0,105.0
Bowfinger,1999-08-13,55000000.0,66458769.0,98699769.0,PG-13,97,Comedy,Frank Oz,"Steve Martin, Eddie Murphy, Heather Graham, Christine Baranski",5.0,16.0,14.0,1999.0,8.0,35.0
