Title,Released,Prod_Budget,Rated,Runtime,Genre,Director,Actors,Pirate_Count,Torrentz_Count,Zoogle_Ver_Count,Total_Torrents
What to Expect When You're Expecting,2012-05-18,37500000.0,PG-13,110,"Comedy, Drama, Romance",Kirk Jones,"Cameron Diaz, Jennifer Lopez, Elizabeth Banks, Chace Crawford",44.0,38.0,14.0,96.0
Aloha,2015-05-29,37000000.0,PG-13,105,"Comedy, Drama, Romance",Cameron Crowe,"Bradley Cooper, Emma Stone, Rachel McAdams, Bill Murray",23.0,83.0,45.0,151.0
Nim's Island,2008-04-04,37000000.0,PG,96,"Adventure, Comedy, Family","Jennifer Flackett, Mark Levin","Abigail Breslin, Jodie Foster, Gerard Butler, Michael Carman",41.0,46.0,22.0,109.0
Cop Out,2010-02-26,37000000.0,R,107,"Action, Comedy, Crime",Kevin Smith,"Bruce Willis, Tracy Morgan, Juan Carlos Hernández, Cory Fernandez",87.0,214.0,16.0,317.0
Creed,2015-11-25,37000000.0,PG-13,133,"Drama, Sport",Ryan Coogler,"Michael B. Jordan, Sylvester Stallone, Tessa Thompson, Phylicia Rashad",39.0,220.0,124.0,383.0
Twilight,2008-11-21,37000000.0,PG-13,122,"Drama, Fantasy, Romance",Catherine Hardwicke,"Kristen Stewart, Sarah Clarke, Matt Bushell, Billy Burke",111.0,623.0,58.0,792.0
The Rite,2011-01-28,37000000.0,PG-13,114,"Drama, Horror, Mystery",Mikael Håfström,"Anthony Hopkins, Colin O'Donoghue, Alice Braga, Ciarán Hinds",96.0,229.0,33.0,358.0
We're the Millers,2013-08-07,37000000.0,R,110,"Comedy, Crime",Rawson Marshall Thurber,"Jennifer Aniston, Jason Sudeikis, Emma Roberts, Will Poulter",57.0,124.0,33.0,214.0
Burn After Reading,2008-09-12,37000000.0,R,96,"Comedy, Drama","Ethan Coen, Joel Coen","George Clooney, Frances McDormand, Brad Pitt, John Malkovich",67.0,272.0,33.0,372.0
The Town,2010-09-17,37000000.0,R,125,"Crime, Drama, Thriller",Ben Affleck,"Ben Affleck, Rebecca Hall, Jon Hamm, Jeremy Renner",141.0,287.0,44.0,472.0
Dolphin Tale,2011-09-23,37000000.0,PG,113,"Drama, Family",Charles Martin Smith,"Harry Connick Jr., Ashley Judd, Nathan Gamble, Kris Kristofferson",50.0,133.0,19.0,202.0
Reindeer Games,2000-02-25,36000000.0,R,104,"Action, Crime, Drama",John Frankenheimer,"Ben Affleck, James Frain, Dana Stubblefield, Mark Acheson",11.0,41.0,27.0,79.0
Gattaca,1997-10-24,36000000.0,PG-13,106,"Drama, Sci-Fi, Thriller",Andrew Niccol,"Ethan Hawke, Uma Thurman, Gore Vidal, Xander Berkeley",34.0,119.0,48.0,201.0
John Q,2002-02-15,36000000.0,PG-13,116,"Crime, Drama, Thriller",Nick Cassavetes,"Gabriela Oltean, Denzel Washington, Kimberly Elise, Ron Annabelle",17.0,83.0,27.0,127.0
Hot Tub Time Machine,2010-03-26,36000000.0,R,101,"Comedy, Sci-Fi",Steve Pink,"John Cusack, Clark Duke, Craig Robinson, Rob Corddry",98.0,199.0,14.0,311.0
Blue Streak,1999-09-17,36000000.0,PG-13,93,"Action, Comedy, Crime",Les Mayfield,"Martin Lawrence, Luke Wilson, Peter Greene, Dave Chappelle",31.0,83.0,14.0,128.0
Breakdown,1997-05-02,36000000.0,R,93,"Action, Crime, Drama",Jonathan Mostow,"Kurt Russell, J.T. Walsh, Kathleen Quinlan, M.C. Gainey",7.0,35.0,20.0,62.0
A Man Apart,2003-04-04,36000000.0,R,109,"Action, Crime, Drama",F. Gary Gray,"Vin Diesel, Larenz Tate, Timothy Olyphant, Geno Silva",22.0,111.0,25.0,158.0
Never Say Never Again,1983-10-07,36000000.0,PG,134,"Action, Adventure, Thriller",Irvin Kershner,"Sean Connery, Klaus Maria Brandauer, Max von Sydow, Barbara Carrera",24.0,58.0,24.0,106.0
The Ladykillers,2004-03-26,35000000.0,R,104,"Comedy, Crime, Thriller","Ethan Coen, Joel Coen","Tom Hanks, Irma P. Hall, Marlon Wayans, J.K. Simmons",14.0,30.0,19.0,63.0
Guess Who,2005-03-25,35000000.0,PG-13,105,"Comedy, Romance",Kevin Rodney Sullivan,"Bernie Mac, Ashton Kutcher, Zoe Saldana, Judith Scott",12.0,25.0,11.0,48.0
Resident Evil,2002-03-15,35000000.0,R,100,"Action, Horror, Sci-Fi",Paul W.S. Anderson,"Ryan McCluskey, Oscar Pearce, Indra Ové, Anna Bolt",74.0,143.0,49.0,266.0
Predator 2,1990-11-21,35000000.0,R,108,"Action, Horror, Sci-Fi",Stephen Hopkins,"Kevin Peter Hall, Danny Glover, Gary Busey, Rubén Blades",29.0,115.0,48.0,192.0
House of Wax,2005-05-06,35000000.0,R,108,Horror,Jaume Collet-Serra,"Elisha Cuthbert, Chad Michael Murray, Brian Van Holt, Paris Hilton",32.0,91.0,24.0,147.0
The Man in the Iron Mask,1998-03-13,35000000.0,PG-13,132,"Action, Adventure",Randall Wallace,"Leonardo DiCaprio, Jeremy Irons, John Malkovich, Gérard Depardieu",16.0,51.0,28.0,95.0
Furry Vengeance,2010-04-30,35000000.0,PG,92,"Comedy, Family",Roger Kumble,"Brendan Fraser, Ricky Garcia, Eugene Cordero, Patrice O'Neal",40.0,89.0,13.0,142.0
Queen of the Damned,2002-02-22,35000000.0,R,101,"Drama, Fantasy, Horror",Michael Rymer,"Aaliyah, Stuart Townsend, Marguerite Moreau, Vincent Perez",22.0,56.0,21.0,99.0
The Fountain,2006-11-22,35000000.0,PG-13,96,"Drama, Sci-Fi",Darren Aronofsky,"Hugh Jackman, Rachel Weisz, Ellen Burstyn, Mark Margolis",32.0,127.0,36.0,195.0
The Four Feathers,2002-09-20,35000000.0,PG-13,132,"Adventure, Drama, Romance",Shekhar Kapur,"Wes Bentley, Mohamed Bouich, Campbell Brown, Daniel Caltagirone",16.0,41.0,15.0,72.0
In Time,2011-10-28,35000000.0,PG-13,109,"Action, Sci-Fi, Thriller",Andrew Niccol,"Justin Timberlake, Olivia Wilde, Shyloh Oostwald, Johnny Galecki",184.0,654.0,92.0,930.0
Old Dogs,2009-11-25,35000000.0,PG,88,"Comedy, Family",Walt Becker,"John Travolta, Robin Williams, Kelly Preston, Conner Rayburn",45.0,106.0,19.0,170.0
Parker,2013-01-25,35000000.0,R,118,"Action, Crime, Romance",Taylor Hackford,"Jason Statham, Jennifer Lopez, Michael Chiklis, Wendell Pierce",126.0,540.0,22.0,688.0
TMNT,2007-03-23,35000000.0,PG,87,"Animation, Action, Adventure",Kevin Munroe,"Chris Evans, Sarah Michelle Gellar, Mako, Kevin Smith",26.0,269.0,16.0,311.0
Broken City,2013-01-18,35000000.0,R,109,"Crime, Drama, Thriller",Allen Hughes,"Mark Wahlberg, Russell Crowe, Catherine Zeta-Jones, Jeffrey Wright",106.0,245.0,22.0,373.0
Radio,2003-10-24,35000000.0,PG,109,"Biography, Drama, Sport",Michael Tollin,"Cuba Gooding Jr., Ed Harris, Alfre Woodard, S. Epatha Merkerson",8.0,186.0,16.0,210.0
Black Knight,2001-11-21,35000000.0,PG-13,95,"Adventure, Comedy, Fantasy",Gil Junger,"Martin Lawrence, Marsha Thomason, Tom Wilkinson, Vincent Regan",12.0,44.0,24.0,80.0
Friends with Benefits,2011-07-22,35000000.0,R,109,"Comedy, Romance",Will Gluck,"Justin Timberlake, Mila Kunis, Patricia Clarkson, Jenna Elfman",117.0,194.0,20.0,331.0
Blast from the Past,1999-02-12,35000000.0,PG-13,112,"Comedy, Drama, Romance",Hugh Wilson,"Brendan Fraser, Alicia Silverstone, Christopher Walken, Sissy Spacek",11.0,31.0,24.0,66.0
Premium Rush,2012-08-24,35000000.0,PG-13,91,"Action, Crime, Thriller",David Koepp,"Joseph Gordon-Levitt, Dania Ramirez, Sean Kennedy, Kym Perfetto",66.0,227.0,14.0,307.0
Knock Off,1998-09-04,35000000.0,R,91,"Action, Comedy, Thriller",Hark Tsui,"Jean-Claude Van Damme, Rob Schneider, Lela Rochon, Paul Sorvino",3.0,15.0,12.0,30.0
Alex Cross,2012-10-19,35000000.0,PG-13,101,"Action, Crime, Mystery",Rob Cohen,"Tyler Perry, Edward Burns, Matthew Fox, Jean Reno",67.0,186.0,33.0,286.0
Untraceable,2008-01-25,35000000.0,R,101,"Crime, Drama, Thriller",Gregory Hoblit,"Diane Lane, Billy Burke, Colin Hanks, Joseph Cross",46.0,229.0,24.0,299.0
Jersey Girl,2004-03-26,35000000.0,PG-13,102,"Comedy, Drama, Romance",Kevin Smith,"Betty Aberlin, Matt McFarland, Sarah Stafford, Paulie Litt",8.0,35.0,12.0,55.0
The Blind Side,2009-11-20,35000000.0,PG-13,129,"Biography, Drama, Sport",John Lee Hancock,"Sandra Bullock, Tim McGraw, Quinton Aaron, Jae Head",60.0,223.0,29.0,312.0
Malcolm X,1992-11-18,35000000.0,PG-13,202,"Biography, Drama, History",Spike Lee,"Denzel Washington, Angela Bassett, Albert Hall, Al Freeman Jr.",20.0,42.0,18.0,80.0
Spy Kids,2001-03-30,35000000.0,PG,88,"Action, Adventure, Comedy",Robert Rodriguez,"Antonio Banderas, Carla Gugino, Alexa PenaVega, Daryl Sabara",19.0,38.0,23.0,80.0
Mirrors,2008-08-15,35000000.0,R,110,"Horror, Mystery",Alexandre Aja,"Kiefer Sutherland, Paula Patton, Cameron Boyce, Erica Gluck",67.0,309.0,41.0,417.0
Flash Gordon,1980-12-05,35000000.0,PG,111,"Action, Adventure, Sci-Fi",Mike Hodges,"Sam J. Jones, Melody Anderson, Max von Sydow, Topol",22.0,77.0,13.0,112.0
Rush Hour,1998-09-18,35000000.0,PG-13,98,"Action, Comedy, Crime",Brett Ratner,"Ken Leung, Jackie Chan, Tom Wilkinson, Tzi Ma",24.0,101.0,35.0,160.0
Sky High,2005-07-29,35000000.0,PG,100,"Adventure, Comedy, Family",Mike Mitchell,"Michael Angarano, Kurt Russell, Kelly Preston, Danielle Panabaker",24.0,66.0,24.0,114.0
Species,1995-07-07,35000000.0,R,108,"Horror, Sci-Fi",Roger Donaldson,"Ben Kingsley, Michael Madsen, Alfred Molina, Forest Whitaker",21.0,72.0,23.0,116.0
Hot Pursuit,2015-05-08,35000000.0,PG-13,87,"Action, Comedy, Crime",Anne Fletcher,"Reese Witherspoon, Sofía Vergara, Matthew Del Negro, Michael Mosley",30.0,127.0,85.0,242.0
Max Payne,2008-10-17,35000000.0,PG-13,100,"Action, Crime, Drama",John Moore,"Mark Wahlberg, Mila Kunis, Beau Bridges, Ludacris",97.0,386.0,44.0,527.0
The Order,2003-09-05,35000000.0,R,102,"Action, Mystery, Thriller",Brian Helgeland,"Heath Ledger, Shannyn Sossamon, Benno Fürmann, Mark Addy",15.0,32.0,15.0,62.0
Superhero Movie,2008-03-28,35000000.0,PG-13,75,"Action, Comedy, Sci-Fi",Craig Mazin,"Drake Bell, Sara Paxton, Christopher McDonald, Leslie Nielsen",33.0,172.0,18.0,223.0
Horrible Bosses,2011-07-08,35000000.0,R,98,"Comedy, Crime",Seth Gordon,"Jason Bateman, Steve Wiebe, Kevin Spacey, Charlie Day",108.0,272.0,44.0,424.0
Cape Fear,1991-11-15,35000000.0,R,128,"Crime, Thriller",Martin Scorsese,"Robert De Niro, Nick Nolte, Jessica Lange, Juliette Lewis",28.0,72.0,31.0,131.0
Donnie Brasco,1997-02-28,35000000.0,R,127,"Biography, Crime, Drama",Mike Newell,"Al Pacino, Johnny Depp, Michael Madsen, Bruno Kirby",48.0,121.0,35.0,204.0
Concussion,2015-12-25,35000000.0,PG-13,123,"Biography, Drama, Sport",Peter Landesman,"Will Smith, Alec Baldwin, Albert Brooks, Gugu Mbatha-Raw",25.0,121.0,125.0,271.0
Whiteout,2009-09-11,35000000.0,R,101,"Action, Crime, Mystery",Dominic Sena,"Kate Beckinsale, Gabriel Macht, Tom Skerritt, Columbus Short",53.0,174.0,30.0,257.0
The Back-up Plan,2010-04-23,35000000.0,PG-13,104,"Comedy, Romance",Alan Poul,"Jennifer Lopez, Alex O'Loughlin, Michaela Watkins, Eric Christian Olsen",77.0,147.0,26.0,250.0
Hoffa,1992-12-25,35000000.0,R,140,"Biography, Crime, Drama",Danny DeVito,"Jack Nicholson, Danny DeVito, Armand Assante, J.T. Walsh",7.0,26.0,13.0,46.0
Ella Enchanted,2004-04-09,35000000.0,PG,96,"Comedy, Family, Fantasy",Tommy O'Haver,"Anne Hathaway, Hugh Dancy, Cary Elwes, Aidan McArdle",8.0,21.0,13.0,42.0
Trainwreck,2015-07-17,35000000.0,R,125,"Comedy, Romance",Judd Apatow,"Colin Quinn, Devin Fabry, Carla Oudin, Amy Schumer",39.0,119.0,59.0,217.0
Flight of the Intruder,1991-01-18,35000000.0,PG-13,115,"Action, Drama, Thriller",John Milius,"Danny Glover, Willem Dafoe, Brad Johnson, Rosanna Arquette",2.0,15.0,12.0,29.0
Bounce,2000-11-17,35000000.0,PG-13,106,"Drama, Romance",Don Roos,"Ben Affleck, Gwyneth Paltrow, Natasha Henstridge, Edward Edwards",5.0,22.0,12.0,39.0
Luther,2003-09-26,35000000.0,PG-13,123,"Biography, Drama, History",Eric Till,"Joseph Fiennes, Alfred Molina, Jonathan Firth, Claire Cox",7.0,35.0,13.0,55.0
The Hangover,2009-06-05,35000000.0,R,100,Comedy,Todd Phillips,"Bradley Cooper, Ed Helms, Zach Galifianakis, Justin Bartha",126.0,593.0,32.0,751.0
Lions for Lambs,2007-11-09,35000000.0,R,92,"Drama, Thriller, War",Robert Redford,"Robert Redford, Meryl Streep, Tom Cruise, Michael Peña",26.0,130.0,15.0,171.0
Identity Thief,2013-02-08,35000000.0,R,111,"Comedy, Crime",Seth Gordon,"Jason Bateman, Melissa McCarthy, Jon Favreau, Amanda Peet",79.0,189.0,17.0,285.0
A Nightmare on Elm Street,2010-04-30,35000000.0,R,95,"Horror, Mystery, Thriller",Samuel Bayer,"Jackie Earle Haley, Kyle Gallner, Rooney Mara, Katie Cassidy",107.0,289.0,33.0,429.0
Unfinished Business,2015-03-06,35000000.0,R,91,Comedy,Ken Scott,"Vince Vaughn, Tom Wilkinson, Dave Franco, Sienna Miller",26.0,82.0,36.0,144.0
Something Borrowed,2011-05-06,35000000.0,PG-13,112,"Comedy, Drama, Romance",Luke Greenfield,"Ginnifer Goodwin, Kate Hudson, Colin Egglesfield, John Krasinski",51.0,112.0,15.0,178.0
True Grit,2010-12-22,35000000.0,PG-13,110,"Adventure, Drama, Western","Ethan Coen, Joel Coen","Jeff Bridges, Hailee Steinfeld, Matt Damon, Josh Brolin",113.0,266.0,46.0,425.0
L.A. Confidential,1997-09-19,35000000.0,R,138,"Crime, Drama, Mystery",Curtis Hanson,"Kevin Spacey, Russell Crowe, Guy Pearce, James Cromwell",47.0,96.0,35.0,178.0
Poltergeist,2015-05-22,35000000.0,PG-13,93,"Horror, Thriller",Gil Kenan,"Sam Rockwell, Rosemarie DeWitt, Saxon Sharbino, Kyle Catlett",58.0,321.0,145.0,524.0
Lethal Weapon 3,1992-05-15,35000000.0,R,118,"Action, Crime, Thriller",Richard Donner,"Mel Gibson, Danny Glover, Joe Pesci, Rene Russo",27.0,54.0,19.0,100.0
License to Wed,2007-07-03,35000000.0,PG-13,91,"Comedy, Romance",Ken Kwapis,"Robin Williams, Mandy Moore, John Krasinski, Eric Christian Olsen",20.0,101.0,12.0,133.0
Batman,1989-06-23,35000000.0,PG-13,126,"Action, Adventure",Tim Burton,"Michael Keaton, Jack Nicholson, Kim Basinger, Robert Wuhl",37.0,196.0,25.0,258.0
Wimbledon,2004-09-17,35000000.0,PG-13,98,"Comedy, Romance, Sport",Richard Loncraine,"Kirsten Dunst, Paul Bettany, Sam Neill, Jon Favreau",7.0,32.0,13.0,52.0
Abduction,2011-09-23,35000000.0,PG-13,106,"Action, Mystery, Thriller",John Singleton,"Jake Andolina, Oriah Acima Andrews, Ken Arnold, Maria Bello",97.0,260.0,31.0,388.0
From Hell,2001-10-19,35000000.0,R,122,"Horror, Mystery, Thriller","Albert Hughes, Allen Hughes","Johnny Depp, Heather Graham, Ian Holm, Robbie Coltrane",24.0,97.0,34.0,155.0
Heist,2001-11-09,35000000.0,R,109,"Action, Crime, Drama",David Mamet,"Gene Hackman, Danny DeVito, Delroy Lindo, Sam Rockwell",8.0,30.0,12.0,50.0
Street Fighter,1994-12-23,35000000.0,PG-13,102,"Action, Adventure, Comedy",Steven E. de Souza,"Jean-Claude Van Damme, Raul Julia, Ming-Na Wen, Damian Chapa",14.0,77.0,19.0,110.0
The Devil Wears Prada,2006-06-30,35000000.0,PG-13,109,"Comedy, Drama, Romance",David Frankel,"Meryl Streep, Anne Hathaway, Emily Blunt, Stanley Tucci",25.0,90.0,27.0,142.0
The Darkest Hour,2011-12-25,34800000.0,PG-13,89,"Action, Adventure, Horror",Chris Gorak,"Emile Hirsch, Olivia Thirlby, Max Minghella, Rachael Taylor",69.0,213.0,22.0,304.0
The Maze Runner,2014-09-19,34000000.0,PG-13,113,"Action, Mystery, Sci-Fi",Wes Ball,"Dylan O'Brien, Aml Ameen, Ki Hong Lee, Blake Cooper",100.0,346.0,69.0,515.0
The Longest Ride,2015-04-10,34000000.0,PG-13,128,"Drama, Romance",George Tillman Jr.,"Britt Robertson, Scott Eastwood, Alan Alda, Jack Huston",30.0,106.0,59.0,195.0
The Watcher,2000-09-08,33000000.0,R,97,"Crime, Horror, Mystery",Joe Charbanic,"James Spader, Marisa Tomei, Keanu Reeves, Ernie Hudson",7.0,34.0,12.0,53.0
The Punisher,2004-04-16,33000000.0,R,124,"Action, Crime, Drama",Jonathan Hensleigh,"A. Russell Andrews, Omar Avila, James Carpinello, Mark Collie",49.0,111.0,33.0,193.0
Doomsday,2008-03-14,33000000.0,R,105,"Action, Sci-Fi, Thriller",Neil Marshall,"Caryn Peterson, Adeola Ariyo, Emma Cleasby, Christine Tomlinson",61.0,357.0,37.0,455.0
A Few Good Men,1992-12-11,33000000.0,R,138,"Drama, Thriller",Rob Reiner,"Tom Cruise, Jack Nicholson, Demi Moore, Kevin Bacon",33.0,56.0,14.0,103.0
Safe,2012-04-27,33000000.0,R,94,"Action, Crime, Thriller",Boaz Yakin,"Jason Statham, Catherine Chan, Robert John Burke, James Hong",96.0,726.0,78.0,900.0
Exit Wounds,2001-03-16,33000000.0,R,101,"Action, Comedy, Crime",Andrzej Bartkowiak,"Steven Seagal, DMX, Isaiah Washington, Anthony Anderson",23.0,70.0,19.0,112.0
Big Momma's House,2000-06-02,33000000.0,PG-13,99,"Action, Comedy, Crime",Raja Gosnell,"Martin Lawrence, Nia Long, Paul Giamatti, Jascha Washington",15.0,20.0,16.0,51.0
Step Up Revolution,2012-07-27,33000000.0,PG-13,99,"Drama, Music, Romance",Scott Speer,"Cleopatra Coleman, Ryan Guzman, Misha Gabriel Hamilton, Michael 'Xeno' Langebeck",66.0,159.0,25.0,250.0
Snakes on a Plane,2006-08-18,33000000.0,R,105,"Action, Adventure, Crime",David R. Ellis,"Samuel L. Jackson, Julianna Margulies, Nathan Phillips, Rachel Blanchard",26.0,110.0,19.0,155.0
Bridesmaids,2011-05-13,32500000.0,R,125,"Comedy, Romance",Paul Feig,"Kristen Wiig, Terry Crews, Maya Rudolph, Tom Yi",111.0,204.0,25.0,340.0
Wanderlust,2012-02-24,32500000.0,R,98,Comedy,David Wain,"Paul Rudd, Jennifer Aniston, Justin Theroux, Alan Alda",44.0,130.0,22.0,196.0
The Big Wedding,2013-04-26,32500000.0,R,89,Comedy,Justin Zackham,"Robert De Niro, Katherine Heigl, Diane Keaton, Amanda Seyfried",34.0,125.0,10.0,169.0
Snow Dogs,2002-01-18,32000000.0,PG,99,"Adventure, Comedy, Family",Brian Levant,"Cuba Gooding Jr., James Coburn, Sisqó, Nichelle Nichols",3.0,28.0,13.0,44.0
Laws of Attraction,2004-04-30,32000000.0,PG-13,90,"Comedy, Romance",Peter Howitt,"Pierce Brosnan, Julianne Moore, Michael Sheen, Parker Posey",5.0,20.0,13.0,38.0
Elf,2003-11-07,32000000.0,PG,97,"Comedy, Family, Fantasy",Jon Favreau,"Will Ferrell, James Caan, Bob Newhart, Edward Asner",34.0,94.0,17.0,145.0
Alive,1993-01-15,32000000.0,R,120,"Adventure, Biography, Drama",Frank Marshall,"Ethan Hawke, Vincent Spano, Josh Hamilton, Bruce Ramsay",21.0,64.0,21.0,106.0
Source Code,2011-04-01,32000000.0,PG-13,93,"Mystery, Sci-Fi, Thriller",Duncan Jones,"Jake Gyllenhaal, Michelle Monaghan, Vera Farmiga, Jeffrey Wright",169.0,414.0,27.0,610.0
1941,1979-12-14,32000000.0,PG,118,"Action, Comedy, War",Steven Spielberg,"Dan Aykroyd, Ned Beatty, John Belushi, Lorraine Gary",12.0,47.0,21.0,80.0
Stigmata,1999-09-10,32000000.0,R,103,Horror,Rupert Wainwright,"Patricia Arquette, Gabriel Byrne, Jonathan Pryce, Nia Long",18.0,70.0,17.0,105.0
The Quick and the Dead,1995-02-10,32000000.0,R,107,"Action, Thriller, Western",Sam Raimi,"Sharon Stone, Gene Hackman, Russell Crowe, Leonardo DiCaprio",21.0,57.0,25.0,103.0
Going the Distance,2010-09-03,32000000.0,R,102,"Comedy, Romance",Nanette Burstein,"Drew Barrymore, Justin Long, Charlie Day, Jason Sudeikis",55.0,87.0,19.0,161.0
Repo Men,2010-03-19,32000000.0,R,111,"Action, Crime, Sci-Fi",Miguel Sapochnik,"Jude Law, Forest Whitaker, Alice Braga, Liev Schreiber",65.0,214.0,31.0,310.0
Takers,2010-08-27,32000000.0,PG-13,107,"Action, Crime, Thriller",John Luessenhop,"Chris Brown, Hayden Christensen, Matt Dillon, Michael Ealy",122.0,184.0,17.0,323.0
The Number 23,2007-02-23,32000000.0,R,101,"Mystery, Thriller",Joel Schumacher,"Jim Carrey, Virginia Madsen, Logan Lerman, Danny Huston",29.0,124.0,23.0,176.0
Nacho Libre,2006-06-16,32000000.0,PG,92,"Comedy, Family, Sport",Jared Hess,"Jack Black, Ana de la Reguera, Héctor Jiménez, Darius Rose",22.0,63.0,10.0,95.0
Apocalypse Now,1979-08-15,31500000.0,R,153,"Drama, War",Francis Ford Coppola,"Marlon Brando, Martin Sheen, Robert Duvall, Frederic Forrest",64.0,122.0,40.0,226.0
Criminal,2016-04-15,31500000.0,R,113,"Action, Crime, Drama",Ariel Vromen,"Kevin Costner, Gary Oldman, Tommy Lee Jones, Jordi Mollà",14.0,157.0,100.0,271.0
Extraordinary Measures,2010-01-22,31000000.0,PG,106,Drama,Tom Vaughan,"Brendan Fraser, Harrison Ford, Keri Russell, Meredith Droeger",50.0,104.0,15.0,169.0
Vacation,2015-07-29,31000000.0,R,99,"Adventure, Comedy","John Francis Daley, Jonathan M. Goldstein","Ed Helms, Christina Applegate, Skyler Gisondo, Steele Stebbins",49.0,480.0,119.0,648.0
Hearts in Atlantis,2001-09-28,31000000.0,PG-13,101,"Drama, Mystery",Scott Hicks,"Anthony Hopkins, Anton Yelchin, Hope Davis, Mika Boorem",7.0,28.0,16.0,51.0
Moonraker,1979-06-29,31000000.0,PG,126,"Action, Adventure, Sci-Fi",Lewis Gilbert,"Roger Moore, Lois Chiles, Michael Lonsdale, Richard Kiel",25.0,85.0,20.0,130.0
Flight,2012-11-02,31000000.0,R,138,"Drama, Thriller",Robert Zemeckis,"Nadine Velazquez, Denzel Washington, Carter Cabassa, Adam C. Edwards",118.0,410.0,52.0,580.0
Frequency,2000-04-28,31000000.0,PG-13,118,"Crime, Drama, Mystery",Gregory Hoblit,"Dennis Quaid, Jim Caviezel, Shawn Doyle, Elizabeth Mitchell",26.0,82.0,35.0,143.0
Get Shorty,1995-10-20,30250000.0,R,105,"Comedy, Crime, Thriller",Barry Sonnenfeld,"John Travolta, Gene Hackman, Rene Russo, Danny DeVito",14.0,54.0,24.0,92.0
The First Wives Club,1996-09-20,30000000.0,PG,103,Comedy,Hugh Wilson,"Goldie Hawn, Bette Midler, Diane Keaton, Maggie Smith",4.0,13.0,11.0,28.0
Wing Commander,1999-03-12,30000000.0,PG-13,100,"Action, Adventure, Sci-Fi",Chris Roberts,"Freddie Prinze Jr., Saffron Burrows, Matthew Lillard, Tchéky Karyo",14.0,43.0,12.0,69.0
The Whole Ten Yards,2004-04-09,30000000.0,PG-13,98,"Comedy, Crime, Thriller",Howard Deutch,"Bruce Willis, Matthew Perry, Amanda Peet, Kevin Pollak",16.0,30.0,27.0,73.0
The Cave,2005-08-26,30000000.0,PG-13,97,"Adventure, Horror, Thriller",Bruce Hunt,"Cole Hauser, Eddie Cibrian, Morris Chestnut, Lena Headey",11.0,101.0,25.0,137.0
The Family,2013-09-13,30000000.0,R,111,"Comedy, Crime, Thriller",Luc Besson,"Robert De Niro, Michelle Pfeiffer, Dianna Agron, John D'Leo",63.0,416.0,52.0,531.0
Fright Night,2011-08-19,30000000.0,R,106,"Comedy, Horror",Craig Gillespie,"Anton Yelchin, Colin Farrell, Toni Collette, David Tennant",101.0,256.0,26.0,383.0
Analyze This,1999-03-05,30000000.0,R,103,"Comedy, Crime",Harold Ramis,"Robert De Niro, Billy Crystal, Lisa Kudrow, Chazz Palminteri",17.0,42.0,22.0,81.0
The Five-Year Engagement,2012-04-27,30000000.0,R,124,"Comedy, Romance",Nicholas Stoller,"Jason Segel, Emily Blunt, Chris Pratt, Alison Brie",40.0,126.0,15.0,181.0
Dead Man Down,2013-03-08,30000000.0,R,118,"Action, Crime, Drama",Niels Arden Oplev,"Colin Farrell, Noomi Rapace, Terrence Howard, Dominic Cooper",111.0,255.0,14.0,380.0
Meet the Spartans,2008-01-25,30000000.0,PG-13,86,Comedy,"Jason Friedberg, Aaron Seltzer","Sean Maguire, Carmen Electra, Ken Davitian, Kevin Sorbo",22.0,264.0,18.0,304.0
Lee Daniels' The Butler,2013-08-16,30000000.0,PG-13,132,"Biography, Drama",Lee Daniels,"Forest Whitaker, David Banner, Michael Rainey Jr., LaJessie Smith",40.0,5.0,10.0,55.0
P.S. I Love You,2007-12-21,30000000.0,PG-13,126,"Drama, Romance",Richard LaGravenese,"Hilary Swank, Gerard Butler, Lisa Kudrow, Gina Gershon",43.0,93.0,34.0,170.0
The Addams Family,1991-11-22,30000000.0,PG-13,99,"Comedy, Fantasy",Barry Sonnenfeld,"Anjelica Huston, Raul Julia, Christopher Lloyd, Dan Hedaya",17.0,50.0,24.0,91.0
The Cabin in the Woods,2012-04-13,30000000.0,R,95,"Fantasy, Horror, Mystery",Drew Goddard,"Kristen Connolly, Chris Hemsworth, Anna Hutchison, Fran Kranz",105.0,111.0,10.0,226.0
Racing Stripes,2005-01-14,30000000.0,PG,102,"Adventure, Comedy, Drama",Frederik Du Chau,"Bruce Greenwood, Hayden Panettiere, Caspar Poyck, Gary Bullock",15.0,21.0,10.0,46.0
Glory Road,2006-01-13,30000000.0,PG,118,"Biography, Drama, Sport",James Gartner,"Josh Lucas, Derek Luke, Austin Nichols, Jon Voight",6.0,33.0,14.0,53.0
Hope Floats,1998-05-29,30000000.0,PG-13,114,"Drama, Romance",Forest Whitaker,"Sandra Bullock, Harry Connick Jr., Gena Rowlands, Mae Whitman",5.0,14.0,12.0,31.0
Message in a Bottle,1999-02-12,30000000.0,PG-13,131,"Drama, Romance",Luis Mandoki,"Kevin Costner, Robin Wright, Paul Newman, John Savage",18.0,40.0,14.0,72.0
Stranger Than Fiction,2006-11-10,30000000.0,PG-13,113,"Comedy, Drama, Fantasy",Marc Forster,"Will Ferrell, William Dick, Guy Massey, Martha Espinoza",32.0,97.0,20.0,149.0
Black Rain,1989-09-22,30000000.0,R,125,"Action, Crime, Thriller",Ridley Scott,"Michael Douglas, Andy Garcia, Ken Takakura, Kate Capshaw",16.0,55.0,33.0,104.0
The Notebook,2004-06-25,30000000.0,PG-13,123,"Drama, Romance",Nick Cassavetes,"Tim Ivey, Gena Rowlands, Starletta DuPois, James Garner",48.0,127.0,52.0,227.0
Baby Mama,2008-04-25,30000000.0,PG-13,99,"Comedy, Romance",Michael McCullers,"Amy Poehler, Tina Fey, Greg Kinnear, Dax Shepard",20.0,70.0,12.0,102.0
Step Up 3D,2010-08-06,30000000.0,PG-13,107,"Drama, Music, Romance",Jon M. Chu,"Rick Malambri, Adam G. Sevani, Sharni Vinson, Alyson Stoner",67.0,69.0,16.0,152.0
The Running Man,1987-11-13,30000000.0,R,101,"Action, Crime, Sci-Fi",Paul Michael Glaser,"Arnold Schwarzenegger, Maria Conchita Alonso, Yaphet Kotto, Jim Brown",24.0,77.0,41.0,142.0
Pride and Glory,2008-10-24,30000000.0,R,130,"Crime, Drama, Thriller",Gavin O'Connor,"Colin Farrell, Edward Norton, Jon Voight, Noah Emmerich",50.0,189.0,17.0,256.0
A View to a Kill,1985-05-24,30000000.0,PG,131,"Action, Adventure, Thriller",John Glen,"Roger Moore, Christopher Walken, Tanya Roberts, Grace Jones",26.0,75.0,23.0,124.0
Secondhand Lions,2003-09-19,30000000.0,PG,109,"Comedy, Drama, Family",Tim McCanlies,"Michael Caine, Robert Duvall, Haley Joel Osment, Kyra Sedgwick",16.0,32.0,16.0,64.0
In Dreams,1999-01-15,30000000.0,R,100,"Drama, Fantasy, Thriller",Neil Jordan,"Annette Bening, Katie Sagona, Aidan Quinn, Robert Downey Jr.",2.0,10.0,16.0,28.0
Southpaw,2015-07-24,30000000.0,R,124,"Action, Drama, Sport",Antoine Fuqua,"Jake Gyllenhaal, Rachel McAdams, Forest Whitaker, Oona Laurence",46.0,217.0,132.0,395.0
Trapped,2002-09-20,30000000.0,R,106,"Crime, Drama, Thriller",Luis Mandoki,"Charlize Theron, Courtney Love, Stuart Townsend, Kevin Bacon",9.0,43.0,15.0,67.0
The Three Stooges,2012-04-13,30000000.0,PG,92,Comedy,"Bobby Farrelly, Peter Farrelly","Sean Hayes, Will Sasso, Chris Diamantopoulos, Jane Lynch",54.0,166.0,10.0,230.0
Blue Crush,2002-08-16,30000000.0,PG-13,104,"Drama, Romance, Sport",John Stockwell,"Kate Bosworth, Matthew Davis, Michelle Rodriguez, Sanoe Lake",11.0,26.0,10.0,47.0
The Last Stand,2013-01-18,30000000.0,R,107,"Action, Crime, Thriller",Jee-woon Kim,"Arron Shiver, Arnold Schwarzenegger, Titos Menchaca, Richard Dillard",137.0,342.0,32.0,511.0
American Pie 2,2001-08-10,30000000.0,R,108,Comedy,J.B. Rogers,"Jason Biggs, Shannon Elizabeth, Alyson Hannigan, Chris Klein",21.0,79.0,25.0,125.0
The Vow,2012-02-10,30000000.0,PG-13,104,"Drama, Romance",Michael Sucsy,"Rachel McAdams, Channing Tatum, Jessica Lange, Sam Neill",87.0,223.0,30.0,340.0
Hope Springs,2012-08-08,30000000.0,PG-13,100,"Comedy, Drama, Romance",David Frankel,"Meryl Streep, Tommy Lee Jones, Steve Carell, Jean Smart",29.0,63.0,17.0,109.0
Big Daddy,1999-06-25,30000000.0,PG-13,93,"Comedy, Drama",Dennis Dugan,"Adam Sandler, Joey Lauren Adams, Jon Stewart, Cole Sprouse",22.0,45.0,25.0,92.0
